22:34:54.253034 IP tesis-PC.52792 > 10.244.0.176.5000: Flags [S], seq 2979732277, win 64860, options [mss 1410,sackOK,TS val 1697631012 ecr 0,nop,wscale 7], length 0
22:34:54.253162 IP 10.244.0.176.5000 > tesis-PC.52792: Flags [S.], seq 2981804444, ack 2979732278, win 64308, options [mss 1410,sackOK,TS val 2973946885 ecr 1697631012,nop,wscale 7], length 0
22:34:54.253191 IP tesis-PC.52792 > 10.244.0.176.5000: Flags [.], ack 1, win 507, options [nop,nop,TS val 1697631012 ecr 2973946885], length 0
22:34:54.253729 IP tesis-PC.52792 > 10.244.0.176.5000: Flags [P.], seq 1:105, ack 1, win 507, options [nop,nop,TS val 1697631013 ecr 2973946885], length 104
22:34:54.253776 IP 10.244.0.176.5000 > tesis-PC.52792: Flags [.], ack 105, win 502, options [nop,nop,TS val 2973946886 ecr 1697631013], length 0
22:34:54.254512 IP 10.244.0.176.5000 > tesis-PC.52792: Flags [P.], seq 1:1434, ack 105, win 502, options [nop,nop,TS val 2973946886 ecr 1697631013], length 1433
22:34:54.254549 IP tesis-PC.52792 > 10.244.0.176.5000: Flags [.], ack 1434, win 502, options [nop,nop,TS val 1697631014 ecr 2973946886], length 0
22:34:54.254802 IP 10.244.0.176.5000 > tesis-PC.52792: Flags [F.], seq 1434, ack 105, win 502, options [nop,nop,TS val 2973946887 ecr 1697631014], length 0
22:34:54.255054 IP tesis-PC.52792 > 10.244.0.176.5000: Flags [F.], seq 105, ack 1435, win 502, options [nop,nop,TS val 1697631014 ecr 2973946887], length 0
22:34:54.255205 IP 10.244.0.176.5000 > tesis-PC.52792: Flags [.], ack 106, win 502, options [nop,nop,TS val 2973946887 ecr 1697631014], length 0
22:34:54.543324 IP 10.244.0.159.55204 > tesis-PC.6443: Flags [P.], seq 1633100868:1633100907, ack 2031941100, win 10142, options [nop,nop,TS val 2061574467 ecr 2544391528], length 39
22:34:54.547750 IP 10.96.0.1.https > 10.244.0.159.55204: Flags [P.], seq 2031941100:2031941189, ack 1633100907, win 501, options [nop,nop,TS val 2544393534 ecr 2061574467], length 89
22:34:54.547971 IP 10.96.0.1.https > 10.244.0.159.55204: Flags [P.], seq 89:880, ack 1, win 501, options [nop,nop,TS val 2544393534 ecr 2061574467], length 791
22:34:54.548215 IP 10.244.0.159.55204 > tesis-PC.6443: Flags [.], ack 881, win 10142, options [nop,nop,TS val 2061574472 ecr 2544393534], length 0
22:34:54.548896 IP 10.244.0.159.55204 > tesis-PC.6443: Flags [P.], seq 39:78, ack 881, win 10142, options [nop,nop,TS val 2061574473 ecr 2544393534], length 39
22:34:54.553938 IP 10.96.0.1.https > 10.244.0.159.55204: Flags [P.], seq 880:947, ack 40, win 501, options [nop,nop,TS val 2544393540 ecr 2061574473], length 67
22:34:54.554119 IP 10.96.0.1.https > 10.244.0.159.55204: Flags [P.], seq 947:1750, ack 40, win 501, options [nop,nop,TS val 2544393540 ecr 2061574473], length 803
22:34:54.554196 IP 10.244.0.159.55204 > tesis-PC.6443: Flags [.], ack 1751, win 10142, options [nop,nop,TS val 2061574478 ecr 2544393540], length 0
22:34:54.554537 IP 10.244.0.159.55204 > tesis-PC.6443: Flags [P.], seq 78:113, ack 1751, win 10142, options [nop,nop,TS val 2061574478 ecr 2544393540], length 35
22:34:54.555266 IP 10.244.0.159.55204 > tesis-PC.6443: Flags [P.], seq 113:154, ack 1751, win 10142, options [nop,nop,TS val 2061574479 ecr 2544393540], length 41
22:34:54.555396 IP 10.244.0.159.55204 > tesis-PC.6443: Flags [P.], seq 154:945, ack 1751, win 10142, options [nop,nop,TS val 2061574479 ecr 2544393540], length 791
22:34:54.555405 IP 10.96.0.1.https > 10.244.0.159.55204: Flags [.], ack 116, win 501, options [nop,nop,TS val 2544393541 ecr 2061574478], length 0
22:34:54.563642 IP 10.96.0.1.https > 10.244.0.159.55204: Flags [P.], seq 1750:1816, ack 907, win 501, options [nop,nop,TS val 2544393550 ecr 2061574479], length 66
22:34:54.563840 IP 10.96.0.1.https > 10.244.0.159.55204: Flags [P.], seq 1816:2607, ack 907, win 501, options [nop,nop,TS val 2544393550 ecr 2061574479], length 791
22:34:54.563998 IP 10.244.0.159.55204 > tesis-PC.6443: Flags [.], ack 2608, win 10142, options [nop,nop,TS val 2061574488 ecr 2544393550], length 0
22:34:54.564355 IP 10.244.0.159.55204 > tesis-PC.6443: Flags [P.], seq 945:984, ack 2608, win 10142, options [nop,nop,TS val 2061574488 ecr 2544393550], length 39
22:34:54.568179 IP 10.96.0.1.https > 10.244.0.159.55204: Flags [P.], seq 2607:2673, ack 946, win 501, options [nop,nop,TS val 2544393554 ecr 2061574488], length 66
22:34:54.568421 IP 10.96.0.1.https > 10.244.0.159.55204: Flags [P.], seq 2673:3476, ack 946, win 501, options [nop,nop,TS val 2544393554 ecr 2061574488], length 803
22:34:54.568504 IP 10.244.0.159.55204 > tesis-PC.6443: Flags [.], ack 3477, win 10142, options [nop,nop,TS val 2061574492 ecr 2544393554], length 0
22:34:54.569161 IP 10.244.0.159.55204 > tesis-PC.6443: Flags [P.], seq 984:1025, ack 3477, win 10142, options [nop,nop,TS val 2061574493 ecr 2544393554], length 41
22:34:54.569259 IP 10.244.0.159.55204 > tesis-PC.6443: Flags [P.], seq 1025:1828, ack 3477, win 10142, options [nop,nop,TS val 2061574493 ecr 2544393554], length 803
22:34:54.569446 IP 10.96.0.1.https > 10.244.0.159.55204: Flags [.], ack 1790, win 501, options [nop,nop,TS val 2544393555 ecr 2061574493], length 0
22:34:54.580360 IP 10.96.0.1.https > 10.244.0.159.55204: Flags [P.], seq 3476:3542, ack 1790, win 501, options [nop,nop,TS val 2544393566 ecr 2061574493], length 66
22:34:54.580504 IP 10.96.0.1.https > 10.244.0.159.55204: Flags [P.], seq 3542:4345, ack 1790, win 501, options [nop,nop,TS val 2544393566 ecr 2061574493], length 803
22:34:54.580611 IP 10.244.0.159.55204 > tesis-PC.6443: Flags [.], ack 4346, win 10142, options [nop,nop,TS val 2061574505 ecr 2544393566], length 0
22:34:54.828099 IP 10.244.0.178.36746 > 10.244.0.177.4997: UDP, length 25
22:34:54.828151 IP 10.244.0.178.36746 > 10.244.0.177.4997: UDP, length 25
22:34:54.828304 IP 10.244.0.177.4997 > 10.244.0.178.36746: UDP, length 17
22:34:54.828367 IP 10.244.0.177.4997 > 10.244.0.178.36746: UDP, length 17
22:34:55.071346 IP 10.96.0.1.https > 10.244.0.160.56398: Flags [P.], seq 3708049829:3708049934, ack 2085701578, win 9693, options [nop,nop,TS val 4071863661 ecr 1928899743], length 105
22:34:55.114251 IP 10.244.0.160.56398 > tesis-PC.6443: Flags [.], ack 3708049934, win 3848, options [nop,nop,TS val 1928909929 ecr 4071863661], length 0
22:34:55.252210 IP tesis-PC.52798 > 10.244.0.176.5000: Flags [S], seq 931056158, win 64860, options [mss 1410,sackOK,TS val 1697632011 ecr 0,nop,wscale 7], length 0
22:34:55.252270 IP 10.244.0.176.5000 > tesis-PC.52798: Flags [S.], seq 18433197, ack 931056159, win 64308, options [mss 1410,sackOK,TS val 2973947884 ecr 1697632011,nop,wscale 7], length 0
22:34:55.252286 IP tesis-PC.52798 > 10.244.0.176.5000: Flags [.], ack 1, win 507, options [nop,nop,TS val 1697632011 ecr 2973947884], length 0
22:34:55.252471 IP tesis-PC.52798 > 10.244.0.176.5000: Flags [P.], seq 1:105, ack 1, win 507, options [nop,nop,TS val 1697632011 ecr 2973947884], length 104
22:34:55.252485 IP 10.244.0.176.5000 > tesis-PC.52798: Flags [.], ack 105, win 502, options [nop,nop,TS val 2973947884 ecr 1697632011], length 0
22:34:55.252991 IP 10.244.0.176.5000 > tesis-PC.52798: Flags [P.], seq 1:1434, ack 105, win 502, options [nop,nop,TS val 2973947885 ecr 1697632011], length 1433
22:34:55.253004 IP tesis-PC.52798 > 10.244.0.176.5000: Flags [.], ack 1434, win 502, options [nop,nop,TS val 1697632012 ecr 2973947885], length 0
22:34:55.253074 IP 10.244.0.176.5000 > tesis-PC.52798: Flags [F.], seq 1434, ack 105, win 502, options [nop,nop,TS val 2973947885 ecr 1697632012], length 0
22:34:55.253284 IP tesis-PC.52798 > 10.244.0.176.5000: Flags [F.], seq 105, ack 1435, win 502, options [nop,nop,TS val 1697632012 ecr 2973947885], length 0
22:34:55.253319 IP 10.244.0.176.5000 > tesis-PC.52798: Flags [.], ack 106, win 502, options [nop,nop,TS val 2973947885 ecr 1697632012], length 0
22:34:55.646330 IP 10.244.0.162.27017 > 10.244.0.171.53600: Flags [P.], seq 70229678:70229982, ack 2467393050, win 501, options [nop,nop,TS val 2431188997 ecr 3551594429], length 304
22:34:55.646389 IP 10.244.0.171.53600 > 10.244.0.162.27017: Flags [.], ack 304, win 2252, options [nop,nop,TS val 3551604440 ecr 2431188997], length 0
22:34:55.646393 IP 10.244.0.171.53600 > 10.244.0.162.27017: Flags [.], ack 304, win 2252, options [nop,nop,TS val 3551604440 ecr 2431188997], length 0
22:34:55.726318 IP 10.244.0.176.53760 > 10.244.0.162.27017: Flags [P.], seq 691333934:691333999, ack 2402306387, win 2168, options [nop,nop,TS val 3747324485 ecr 2777574881], length 65
22:34:55.726336 IP 10.244.0.176.53760 > 10.244.0.162.27017: Flags [P.], seq 0:65, ack 1, win 2168, options [nop,nop,TS val 3747324485 ecr 2777574881], length 65
22:34:55.726381 IP 10.244.0.162.27017 > 10.244.0.176.53760: Flags [.], ack 65, win 501, options [nop,nop,TS val 2777584880 ecr 3747324485,nop,nop,sack 1 {0:65}], length 0
22:34:55.726623 IP 10.244.0.162.27017 > 10.244.0.176.53760: Flags [P.], seq 1:305, ack 65, win 501, options [nop,nop,TS val 2777584881 ecr 3747324485], length 304
22:34:55.726657 IP 10.244.0.176.53760 > 10.244.0.162.27017: Flags [.], ack 305, win 2177, options [nop,nop,TS val 3747324486 ecr 2777584881], length 0
22:34:55.726661 IP 10.244.0.176.53760 > 10.244.0.162.27017: Flags [.], ack 305, win 2177, options [nop,nop,TS val 3747324486 ecr 2777584881], length 0
22:34:55.831612 IP 10.244.0.178.36746 > 10.244.0.177.4997: UDP, length 25
22:34:55.831618 IP 10.244.0.178.36746 > 10.244.0.177.4997: UDP, length 25
22:34:55.831765 IP 10.244.0.177.4997 > 10.244.0.178.36746: UDP, length 17
22:34:55.831814 IP 10.244.0.177.4997 > 10.244.0.178.36746: UDP, length 17
22:34:55.969271 IP 10.244.0.167.34704 > 10.244.0.162.27017: Flags [P.], seq 1120638534:1120638599, ack 4036230610, win 2252, options [nop,nop,TS val 3468842899 ecr 2116580241], length 65
22:34:55.969281 IP 10.244.0.167.34704 > 10.244.0.162.27017: Flags [P.], seq 0:65, ack 1, win 2252, options [nop,nop,TS val 3468842899 ecr 2116580241], length 65
22:34:55.969388 IP 10.244.0.162.27017 > 10.244.0.167.34704: Flags [.], ack 65, win 501, options [nop,nop,TS val 2116590237 ecr 3468842899,nop,nop,sack 1 {0:65}], length 0
22:34:55.969826 IP 10.244.0.162.27017 > 10.244.0.167.34704: Flags [P.], seq 1:305, ack 65, win 501, options [nop,nop,TS val 2116590238 ecr 3468842899], length 304
22:34:55.969894 IP 10.244.0.167.34704 > 10.244.0.162.27017: Flags [.], ack 305, win 2260, options [nop,nop,TS val 3468842900 ecr 2116590238], length 0
22:34:55.969899 IP 10.244.0.167.34704 > 10.244.0.162.27017: Flags [.], ack 305, win 2260, options [nop,nop,TS val 3468842900 ecr 2116590238], length 0
22:34:56.187101 IP 10.244.0.167.55518 > 10.244.0.162.27017: Flags [.], ack 457657008, win 505, options [nop,nop,TS val 3468843117 ecr 2116575355], length 0
22:34:56.187109 IP 10.244.0.167.55518 > 10.244.0.162.27017: Flags [.], ack 1, win 505, options [nop,nop,TS val 3468843117 ecr 2116575355], length 0
22:34:56.187152 IP 10.244.0.162.27017 > 10.244.0.167.55518: Flags [.], ack 1, win 501, options [nop,nop,TS val 2116590455 ecr 3468570480], length 0
22:34:56.189356 IP 10.244.0.171.44386 > 10.244.0.162.27017: Flags [.], ack 2246571678, win 502, options [nop,nop,TS val 3551604983 ecr 2431174438], length 0
22:34:56.189384 IP 10.244.0.171.44386 > 10.244.0.162.27017: Flags [.], ack 1, win 502, options [nop,nop,TS val 3551604983 ecr 2431174438], length 0
22:34:56.189416 IP 10.244.0.162.27017 > 10.244.0.171.44386: Flags [.], ack 1, win 501, options [nop,nop,TS val 2431189540 ecr 3551332344], length 0
22:34:56.253672 IP tesis-PC.52802 > 10.244.0.176.5000: Flags [S], seq 3703867105, win 64860, options [mss 1410,sackOK,TS val 1697633013 ecr 0,nop,wscale 7], length 0
22:34:56.253750 IP 10.244.0.176.5000 > tesis-PC.52802: Flags [S.], seq 450082614, ack 3703867106, win 64308, options [mss 1410,sackOK,TS val 2973948886 ecr 1697633013,nop,wscale 7], length 0
22:34:56.253777 IP tesis-PC.52802 > 10.244.0.176.5000: Flags [.], ack 1, win 507, options [nop,nop,TS val 1697633013 ecr 2973948886], length 0
22:34:56.254265 IP tesis-PC.52802 > 10.244.0.176.5000: Flags [P.], seq 1:105, ack 1, win 507, options [nop,nop,TS val 1697633013 ecr 2973948886], length 104
22:34:56.254321 IP 10.244.0.176.5000 > tesis-PC.52802: Flags [.], ack 105, win 502, options [nop,nop,TS val 2973948886 ecr 1697633013], length 0
22:34:56.255094 IP 10.244.0.176.5000 > tesis-PC.52802: Flags [P.], seq 1:1434, ack 105, win 502, options [nop,nop,TS val 2973948887 ecr 1697633013], length 1433
22:34:56.255119 IP tesis-PC.52802 > 10.244.0.176.5000: Flags [.], ack 1434, win 502, options [nop,nop,TS val 1697633014 ecr 2973948887], length 0
22:34:56.255343 IP 10.244.0.176.5000 > tesis-PC.52802: Flags [F.], seq 1434, ack 105, win 502, options [nop,nop,TS val 2973948887 ecr 1697633014], length 0
22:34:56.255429 IP tesis-PC.52802 > 10.244.0.176.5000: Flags [F.], seq 105, ack 1435, win 502, options [nop,nop,TS val 1697633014 ecr 2973948887], length 0
22:34:56.255488 IP 10.244.0.176.5000 > tesis-PC.52802: Flags [.], ack 106, win 502, options [nop,nop,TS val 2973948887 ecr 1697633014], length 0
22:34:56.441877 IP 10.244.0.164.45018 > 10.244.0.162.27017: Flags [.], ack 290129426, win 502, options [nop,nop,TS val 3720928407 ecr 3059960630], length 0
22:34:56.441884 IP 10.244.0.164.45018 > 10.244.0.162.27017: Flags [.], ack 1, win 502, options [nop,nop,TS val 3720928407 ecr 3059960630], length 0
22:34:56.441935 IP 10.244.0.162.27017 > 10.244.0.164.45018: Flags [.], ack 1, win 501, options [nop,nop,TS val 3059975734 ecr 3720655515], length 0
22:34:56.508848 IP tesis-PC.58934 > 10.244.0.158.8585: Flags [S], seq 3131228601, win 64860, options [mss 1410,sackOK,TS val 4205032780 ecr 0,nop,wscale 7], length 0
22:34:56.508902 IP tesis-PC.58942 > 10.244.0.158.8585: Flags [S], seq 3300210040, win 64860, options [mss 1410,sackOK,TS val 4205032780 ecr 0,nop,wscale 7], length 0
22:34:56.508906 IP 10.244.0.158.8585 > tesis-PC.58934: Flags [S.], seq 2778560104, ack 3131228602, win 64308, options [mss 1410,sackOK,TS val 652985421 ecr 4205032780,nop,wscale 7], length 0
22:34:56.508959 IP tesis-PC.58934 > 10.244.0.158.8585: Flags [.], ack 1, win 507, options [nop,nop,TS val 4205032780 ecr 652985421], length 0
22:34:56.508965 IP 10.244.0.158.8585 > tesis-PC.58942: Flags [S.], seq 3503494663, ack 3300210041, win 64308, options [mss 1410,sackOK,TS val 652985421 ecr 4205032780,nop,wscale 7], length 0
22:34:56.508999 IP tesis-PC.58942 > 10.244.0.158.8585: Flags [.], ack 1, win 507, options [nop,nop,TS val 4205032780 ecr 652985421], length 0
22:34:56.509199 IP tesis-PC.58934 > 10.244.0.158.8585: Flags [P.], seq 1:112, ack 1, win 507, options [nop,nop,TS val 4205032780 ecr 652985421], length 111
22:34:56.509218 IP 10.244.0.158.8585 > tesis-PC.58934: Flags [.], ack 112, win 502, options [nop,nop,TS val 652985421 ecr 4205032780], length 0
22:34:56.509263 IP tesis-PC.58942 > 10.244.0.158.8585: Flags [P.], seq 1:111, ack 1, win 507, options [nop,nop,TS val 4205032780 ecr 652985421], length 110
22:34:56.509287 IP 10.244.0.158.8585 > tesis-PC.58942: Flags [.], ack 111, win 502, options [nop,nop,TS val 652985421 ecr 4205032780], length 0
22:34:56.509598 IP 10.244.0.158.8585 > tesis-PC.58942: Flags [P.], seq 1:171, ack 111, win 502, options [nop,nop,TS val 652985422 ecr 4205032780], length 170
22:34:56.509630 IP tesis-PC.58942 > 10.244.0.158.8585: Flags [.], ack 171, win 506, options [nop,nop,TS val 4205032781 ecr 652985422], length 0
22:34:56.509635 IP 10.244.0.158.8585 > tesis-PC.58934: Flags [P.], seq 1:171, ack 112, win 502, options [nop,nop,TS val 652985422 ecr 4205032780], length 170
22:34:56.509660 IP tesis-PC.58934 > 10.244.0.158.8585: Flags [.], ack 171, win 506, options [nop,nop,TS val 4205032781 ecr 652985422], length 0
22:34:56.509758 IP 10.244.0.158.8585 > tesis-PC.58934: Flags [F.], seq 171, ack 112, win 502, options [nop,nop,TS val 652985422 ecr 4205032781], length 0
22:34:56.509798 IP 10.244.0.158.8585 > tesis-PC.58942: Flags [F.], seq 171, ack 111, win 502, options [nop,nop,TS val 652985422 ecr 4205032781], length 0
22:34:56.509924 IP tesis-PC.58934 > 10.244.0.158.8585: Flags [F.], seq 112, ack 172, win 506, options [nop,nop,TS val 4205032781 ecr 652985422], length 0
22:34:56.509950 IP tesis-PC.58942 > 10.244.0.158.8585: Flags [F.], seq 111, ack 172, win 506, options [nop,nop,TS val 4205032781 ecr 652985422], length 0
22:34:56.509963 IP 10.244.0.158.8585 > tesis-PC.58934: Flags [.], ack 113, win 502, options [nop,nop,TS val 652985422 ecr 4205032781], length 0
22:34:56.509991 IP 10.244.0.158.8585 > tesis-PC.58942: Flags [.], ack 112, win 502, options [nop,nop,TS val 652985422 ecr 4205032781], length 0
22:34:56.596327 IP 10.244.0.159.55204 > tesis-PC.6443: Flags [P.], seq 1828:1867, ack 4346, win 10142, options [nop,nop,TS val 2061576518 ecr 2544393566], length 39
22:34:56.600145 IP 10.96.0.1.https > 10.244.0.159.55204: Flags [P.], seq 4345:4434, ack 1829, win 501, options [nop,nop,TS val 2544395586 ecr 2061576518], length 89
22:34:56.600280 IP 10.96.0.1.https > 10.244.0.159.55204: Flags [P.], seq 4434:5225, ack 1829, win 501, options [nop,nop,TS val 2544395586 ecr 2061576518], length 791
22:34:56.601780 IP 10.244.0.159.55204 > tesis-PC.6443: Flags [.], ack 5226, win 10142, options [nop,nop,TS val 2061576526 ecr 2544395586], length 0
22:34:56.602953 IP 10.244.0.159.55204 > tesis-PC.6443: Flags [P.], seq 1867:1906, ack 5226, win 10142, options [nop,nop,TS val 2061576527 ecr 2544395586], length 39
22:34:56.606258 IP 10.96.0.1.https > 10.244.0.159.55204: Flags [P.], seq 5225:5292, ack 1868, win 501, options [nop,nop,TS val 2544395592 ecr 2061576527], length 67
22:34:56.606321 IP 10.96.0.1.https > 10.244.0.159.55204: Flags [P.], seq 5292:6095, ack 1868, win 501, options [nop,nop,TS val 2544395592 ecr 2061576527], length 803
22:34:56.606438 IP 10.244.0.159.55204 > tesis-PC.6443: Flags [.], ack 6096, win 10142, options [nop,nop,TS val 2061576530 ecr 2544395592], length 0
22:34:56.606660 IP 10.244.0.159.55204 > tesis-PC.6443: Flags [P.], seq 1906:1941, ack 6096, win 10142, options [nop,nop,TS val 2061576531 ecr 2544395592], length 35
22:34:56.607096 IP 10.244.0.159.55204 > tesis-PC.6443: Flags [P.], seq 1941:1982, ack 6096, win 10142, options [nop,nop,TS val 2061576531 ecr 2544395592], length 41
22:34:56.607140 IP 10.244.0.159.55204 > tesis-PC.6443: Flags [P.], seq 1982:2773, ack 6096, win 10142, options [nop,nop,TS val 2061576531 ecr 2544395592], length 791
22:34:56.607151 IP 10.96.0.1.https > 10.244.0.159.55204: Flags [.], ack 1944, win 501, options [nop,nop,TS val 2544395593 ecr 2061576531], length 0
22:34:56.612119 IP 10.96.0.1.https > 10.244.0.159.55204: Flags [P.], seq 6095:6161, ack 2735, win 501, options [nop,nop,TS val 2544395598 ecr 2061576531], length 66
22:34:56.612289 IP 10.96.0.1.https > 10.244.0.159.55204: Flags [P.], seq 6161:6952, ack 2735, win 501, options [nop,nop,TS val 2544395598 ecr 2061576531], length 791
22:34:56.612339 IP 10.244.0.159.55204 > tesis-PC.6443: Flags [.], ack 6953, win 10142, options [nop,nop,TS val 2061576536 ecr 2544395598], length 0
22:34:56.612686 IP 10.244.0.159.55204 > tesis-PC.6443: Flags [P.], seq 2773:2812, ack 6953, win 10142, options [nop,nop,TS val 2061576537 ecr 2544395598], length 39
22:34:56.615312 IP 10.96.0.1.https > 10.244.0.159.55204: Flags [P.], seq 6952:7018, ack 2774, win 501, options [nop,nop,TS val 2544395601 ecr 2061576537], length 66
22:34:56.615372 IP 10.96.0.1.https > 10.244.0.159.55204: Flags [P.], seq 7018:7821, ack 2774, win 501, options [nop,nop,TS val 2544395601 ecr 2061576537], length 803
22:34:56.615475 IP 10.244.0.159.55204 > tesis-PC.6443: Flags [.], ack 7822, win 10142, options [nop,nop,TS val 2061576539 ecr 2544395601], length 0
22:34:56.616340 IP 10.244.0.159.55204 > tesis-PC.6443: Flags [P.], seq 2812:2853, ack 7822, win 10142, options [nop,nop,TS val 2061576540 ecr 2544395601], length 41
22:34:56.616405 IP 10.244.0.159.55204 > tesis-PC.6443: Flags [P.], seq 2853:3656, ack 7822, win 10142, options [nop,nop,TS val 2061576540 ecr 2544395601], length 803
22:34:56.616445 IP 10.96.0.1.https > 10.244.0.159.55204: Flags [.], ack 3618, win 501, options [nop,nop,TS val 2544395602 ecr 2061576540], length 0
22:34:56.617819 IP 10.96.0.1.https > 10.244.0.159.55204: Flags [P.], seq 7821:7856, ack 3618, win 501, options [nop,nop,TS val 2544395604 ecr 2061576540], length 35
22:34:56.622894 IP 10.96.0.1.https > 10.244.0.159.55204: Flags [P.], seq 7856:7922, ack 3618, win 501, options [nop,nop,TS val 2544395609 ecr 2061576540], length 66
22:34:56.622990 IP 10.96.0.1.https > 10.244.0.159.55204: Flags [P.], seq 7922:8725, ack 3618, win 501, options [nop,nop,TS val 2544395609 ecr 2061576540], length 803
22:34:56.623077 IP 10.244.0.159.55204 > tesis-PC.6443: Flags [.], ack 8726, win 10142, options [nop,nop,TS val 2061576547 ecr 2544395604], length 0
22:34:56.835064 IP 10.244.0.178.36746 > 10.244.0.177.4997: UDP, length 25
22:34:56.835071 IP 10.244.0.178.36746 > 10.244.0.177.4997: UDP, length 25
22:34:56.835274 IP 10.244.0.177.4997 > 10.244.0.178.36746: UDP, length 17
22:34:56.835367 IP 10.244.0.177.4997 > 10.244.0.178.36746: UDP, length 17
22:34:56.875529 IP 10.96.0.1.https > 10.244.0.160.56398: Flags [P.], seq 105:204, ack 1, win 9693, options [nop,nop,TS val 4071865465 ecr 1928909929], length 99
22:34:56.875639 IP 10.244.0.160.56398 > tesis-PC.6443: Flags [.], ack 100, win 3848, options [nop,nop,TS val 1928911691 ecr 4071865465], length 0
22:34:57.252460 IP tesis-PC.52816 > 10.244.0.176.5000: Flags [S], seq 2114435280, win 64860, options [mss 1410,sackOK,TS val 1697634011 ecr 0,nop,wscale 7], length 0
22:34:57.252539 IP 10.244.0.176.5000 > tesis-PC.52816: Flags [S.], seq 2846282967, ack 2114435281, win 64308, options [mss 1410,sackOK,TS val 2973949885 ecr 1697634011,nop,wscale 7], length 0
22:34:57.252578 IP tesis-PC.52816 > 10.244.0.176.5000: Flags [.], ack 1, win 507, options [nop,nop,TS val 1697634012 ecr 2973949885], length 0
22:34:57.252953 IP tesis-PC.52816 > 10.244.0.176.5000: Flags [P.], seq 1:105, ack 1, win 507, options [nop,nop,TS val 1697634012 ecr 2973949885], length 104
22:34:57.253019 IP 10.244.0.176.5000 > tesis-PC.52816: Flags [.], ack 105, win 502, options [nop,nop,TS val 2973949885 ecr 1697634012], length 0
22:34:57.253890 IP 10.244.0.176.5000 > tesis-PC.52816: Flags [P.], seq 1:1434, ack 105, win 502, options [nop,nop,TS val 2973949886 ecr 1697634012], length 1433
22:34:57.253917 IP tesis-PC.52816 > 10.244.0.176.5000: Flags [.], ack 1434, win 502, options [nop,nop,TS val 1697634013 ecr 2973949886], length 0
22:34:57.254105 IP 10.244.0.176.5000 > tesis-PC.52816: Flags [F.], seq 1434, ack 105, win 502, options [nop,nop,TS val 2973949886 ecr 1697634013], length 0
22:34:57.254477 IP tesis-PC.52816 > 10.244.0.176.5000: Flags [F.], seq 105, ack 1435, win 502, options [nop,nop,TS val 1697634013 ecr 2973949886], length 0
22:34:57.254550 IP 10.244.0.176.5000 > tesis-PC.52816: Flags [.], ack 106, win 502, options [nop,nop,TS val 2973949886 ecr 1697634013], length 0
22:34:57.596963 IP 10.244.0.164.44990 > 10.244.0.162.27017: Flags [P.], seq 1509312210:1509312275, ack 2081269575, win 2269, options [nop,nop,TS val 3720929562 ecr 3059966889], length 65
22:34:57.596970 IP 10.244.0.164.44990 > 10.244.0.162.27017: Flags [P.], seq 0:65, ack 1, win 2269, options [nop,nop,TS val 3720929562 ecr 3059966889], length 65
22:34:57.597038 IP 10.244.0.162.27017 > 10.244.0.164.44990: Flags [.], ack 65, win 501, options [nop,nop,TS val 3059976889 ecr 3720929562,nop,nop,sack 1 {0:65}], length 0
22:34:57.597351 IP 10.244.0.162.27017 > 10.244.0.164.44990: Flags [P.], seq 1:305, ack 65, win 501, options [nop,nop,TS val 3059976889 ecr 3720929562], length 304
22:34:57.597403 IP 10.244.0.164.44990 > 10.244.0.162.27017: Flags [.], ack 305, win 2277, options [nop,nop,TS val 3720929562 ecr 3059976889], length 0
22:34:57.597421 IP 10.244.0.164.44990 > 10.244.0.162.27017: Flags [.], ack 305, win 2277, options [nop,nop,TS val 3720929562 ecr 3059976889], length 0
22:34:57.671189 IP 10.96.0.1.https > 10.244.0.157.34240: Flags [P.], seq 2131291820:2131291939, ack 3622353960, win 501, options [nop,nop,TS val 788443149 ecr 3991742983], length 119
22:34:57.671287 IP 10.244.0.157.34240 > tesis-PC.6443: Flags [.], ack 2131291939, win 502, options [nop,nop,TS val 3991757977 ecr 788443149], length 0
22:34:57.837790 IP 10.244.0.178.36746 > 10.244.0.177.4997: UDP, length 25
22:34:57.837800 IP 10.244.0.178.36746 > 10.244.0.177.4997: UDP, length 25
22:34:57.837945 IP 10.244.0.177.4997 > 10.244.0.178.36746: UDP, length 17
22:34:57.838098 IP 10.244.0.177.4997 > 10.244.0.178.36746: UDP, length 17
22:34:58.252661 IP tesis-PC.52820 > 10.244.0.176.5000: Flags [S], seq 4086531935, win 64860, options [mss 1410,sackOK,TS val 1697635012 ecr 0,nop,wscale 7], length 0
22:34:58.252747 IP 10.244.0.176.5000 > tesis-PC.52820: Flags [S.], seq 2745425618, ack 4086531936, win 64308, options [mss 1410,sackOK,TS val 2973950885 ecr 1697635012,nop,wscale 7], length 0
22:34:58.252843 IP tesis-PC.52820 > 10.244.0.176.5000: Flags [.], ack 1, win 507, options [nop,nop,TS val 1697635012 ecr 2973950885], length 0
22:34:58.253350 IP tesis-PC.52820 > 10.244.0.176.5000: Flags [P.], seq 1:105, ack 1, win 507, options [nop,nop,TS val 1697635012 ecr 2973950885], length 104
22:34:58.253443 IP 10.244.0.176.5000 > tesis-PC.52820: Flags [.], ack 105, win 502, options [nop,nop,TS val 2973950885 ecr 1697635012], length 0
22:34:58.254217 IP 10.244.0.176.5000 > tesis-PC.52820: Flags [P.], seq 1:1434, ack 105, win 502, options [nop,nop,TS val 2973950886 ecr 1697635012], length 1433
22:34:58.254249 IP tesis-PC.52820 > 10.244.0.176.5000: Flags [.], ack 1434, win 502, options [nop,nop,TS val 1697635013 ecr 2973950886], length 0
22:34:58.254379 IP 10.244.0.176.5000 > tesis-PC.52820: Flags [F.], seq 1434, ack 105, win 502, options [nop,nop,TS val 2973950886 ecr 1697635013], length 0
22:34:58.254645 IP tesis-PC.52820 > 10.244.0.176.5000: Flags [F.], seq 105, ack 1435, win 502, options [nop,nop,TS val 1697635014 ecr 2973950886], length 0
22:34:58.254732 IP 10.244.0.176.5000 > tesis-PC.52820: Flags [.], ack 106, win 502, options [nop,nop,TS val 2973950887 ecr 1697635014], length 0
22:34:58.489810 IP 10.244.0.176.53786 > 10.244.0.162.27017: Flags [.], ack 2754121339, win 652, options [nop,nop,TS val 3747327249 ecr 2777572541], length 0
22:34:58.489819 IP 10.244.0.176.53786 > 10.244.0.162.27017: Flags [.], ack 1, win 652, options [nop,nop,TS val 3747327249 ecr 2777572541], length 0
22:34:58.489871 IP 10.244.0.162.27017 > 10.244.0.176.53786: Flags [.], ack 1, win 501, options [nop,nop,TS val 2777587644 ecr 3747035921], length 0
22:34:58.624144 IP 10.244.0.159.55204 > tesis-PC.6443: Flags [P.], seq 3656:3695, ack 8726, win 10142, options [nop,nop,TS val 2061578548 ecr 2544395604], length 39
22:34:58.627939 IP 10.96.0.1.https > 10.244.0.159.55204: Flags [P.], seq 8725:8814, ack 3657, win 501, options [nop,nop,TS val 2544397614 ecr 2061578548], length 89
22:34:58.628074 IP 10.96.0.1.https > 10.244.0.159.55204: Flags [P.], seq 8814:9605, ack 3657, win 501, options [nop,nop,TS val 2544397614 ecr 2061578548], length 791
22:34:58.628273 IP 10.244.0.159.55204 > tesis-PC.6443: Flags [.], ack 9606, win 10142, options [nop,nop,TS val 2061578552 ecr 2544397614], length 0
22:34:58.628913 IP 10.244.0.159.55204 > tesis-PC.6443: Flags [P.], seq 3695:3734, ack 9606, win 10142, options [nop,nop,TS val 2061578553 ecr 2544397614], length 39
22:34:58.631660 IP 10.96.0.1.https > 10.244.0.159.55204: Flags [P.], seq 9605:9671, ack 3696, win 501, options [nop,nop,TS val 2544397618 ecr 2061578553], length 66
22:34:58.631720 IP 10.96.0.1.https > 10.244.0.159.55204: Flags [P.], seq 9671:10474, ack 3696, win 501, options [nop,nop,TS val 2544397618 ecr 2061578553], length 803
22:34:58.631873 IP 10.244.0.159.55204 > tesis-PC.6443: Flags [.], ack 10475, win 10142, options [nop,nop,TS val 2061578556 ecr 2544397618], length 0
22:34:58.632736 IP 10.244.0.159.55204 > tesis-PC.6443: Flags [P.], seq 3734:3775, ack 10475, win 10142, options [nop,nop,TS val 2061578557 ecr 2544397618], length 41
22:34:58.632820 IP 10.244.0.159.55204 > tesis-PC.6443: Flags [P.], seq 3775:4566, ack 10475, win 10142, options [nop,nop,TS val 2061578557 ecr 2544397618], length 791
22:34:58.632885 IP 10.96.0.1.https > 10.244.0.159.55204: Flags [.], ack 4528, win 501, options [nop,nop,TS val 2544397619 ecr 2061578557], length 0
22:34:58.636950 IP 10.96.0.1.https > 10.244.0.159.55204: Flags [P.], seq 10474:10540, ack 4528, win 501, options [nop,nop,TS val 2544397623 ecr 2061578557], length 66
22:34:58.637011 IP 10.96.0.1.https > 10.244.0.159.55204: Flags [P.], seq 10540:11331, ack 4528, win 501, options [nop,nop,TS val 2544397623 ecr 2061578557], length 791
22:34:58.637220 IP 10.244.0.159.55204 > tesis-PC.6443: Flags [.], ack 11332, win 10142, options [nop,nop,TS val 2061578561 ecr 2544397623], length 0
22:34:58.637496 IP 10.244.0.159.55204 > tesis-PC.6443: Flags [P.], seq 4566:4601, ack 11332, win 10142, options [nop,nop,TS val 2061578561 ecr 2544397623], length 35
22:34:58.638224 IP 10.244.0.159.55204 > tesis-PC.6443: Flags [P.], seq 4601:4640, ack 11332, win 10142, options [nop,nop,TS val 2061578562 ecr 2544397623], length 39
22:34:58.638290 IP 10.96.0.1.https > 10.244.0.159.55204: Flags [.], ack 4602, win 501, options [nop,nop,TS val 2544397624 ecr 2061578561], length 0
22:34:58.642257 IP 10.96.0.1.https > 10.244.0.159.55204: Flags [P.], seq 11331:11524, ack 4602, win 501, options [nop,nop,TS val 2544397628 ecr 2061578561], length 193
22:34:58.642363 IP 10.96.0.1.https > 10.244.0.159.55204: Flags [P.], seq 11524:12327, ack 4602, win 501, options [nop,nop,TS val 2544397628 ecr 2061578561], length 803
22:34:58.642434 IP 10.244.0.159.55204 > tesis-PC.6443: Flags [.], ack 12328, win 10142, options [nop,nop,TS val 2061578566 ecr 2544397628], length 0
22:34:58.643286 IP 10.244.0.159.55204 > tesis-PC.6443: Flags [P.], seq 4640:4681, ack 12328, win 10142, options [nop,nop,TS val 2061578567 ecr 2544397628], length 41
22:34:58.643354 IP 10.244.0.159.55204 > tesis-PC.6443: Flags [P.], seq 4681:5484, ack 12328, win 10142, options [nop,nop,TS val 2061578567 ecr 2544397628], length 803
22:34:58.643528 IP 10.96.0.1.https > 10.244.0.159.55204: Flags [.], ack 5446, win 501, options [nop,nop,TS val 2544397629 ecr 2061578567], length 0
22:34:58.649728 IP 10.96.0.1.https > 10.244.0.159.55204: Flags [P.], seq 12327:12394, ack 5446, win 501, options [nop,nop,TS val 2544397636 ecr 2061578567], length 67
22:34:58.649823 IP 10.96.0.1.https > 10.244.0.159.55204: Flags [P.], seq 12394:13197, ack 5446, win 501, options [nop,nop,TS val 2544397636 ecr 2061578567], length 803
22:34:58.650051 IP 10.244.0.159.55204 > tesis-PC.6443: Flags [.], ack 13198, win 10142, options [nop,nop,TS val 2061578574 ecr 2544397636], length 0
22:34:58.842598 IP 10.244.0.178.36746 > 10.244.0.177.4997: UDP, length 25
22:34:58.842618 IP 10.244.0.178.36746 > 10.244.0.177.4997: UDP, length 25
22:34:58.842853 IP 10.244.0.177.4997 > 10.244.0.178.36746: UDP, length 17
22:34:58.842993 IP 10.244.0.177.4997 > 10.244.0.178.36746: UDP, length 17
22:34:59.171111 IP 10.244.0.162.27017 > 10.244.0.176.53762: Flags [P.], seq 1051090438:1051090742, ack 3221421503, win 501, options [nop,nop,TS val 2777588325 ecr 3747317929], length 304
22:34:59.171182 IP 10.244.0.176.53762 > 10.244.0.162.27017: Flags [.], ack 304, win 2177, options [nop,nop,TS val 3747327930 ecr 2777588325], length 0
22:34:59.171186 IP 10.244.0.176.53762 > 10.244.0.162.27017: Flags [.], ack 304, win 2177, options [nop,nop,TS val 3747327930 ecr 2777588325], length 0
22:34:59.253160 IP tesis-PC.52822 > 10.244.0.176.5000: Flags [S], seq 178734239, win 64860, options [mss 1410,sackOK,TS val 1697636012 ecr 0,nop,wscale 7], length 0
22:34:59.253237 IP 10.244.0.176.5000 > tesis-PC.52822: Flags [S.], seq 233729062, ack 178734240, win 64308, options [mss 1410,sackOK,TS val 2973951885 ecr 1697636012,nop,wscale 7], length 0
22:34:59.253275 IP tesis-PC.52822 > 10.244.0.176.5000: Flags [.], ack 1, win 507, options [nop,nop,TS val 1697636012 ecr 2973951885], length 0
22:34:59.253865 IP tesis-PC.52822 > 10.244.0.176.5000: Flags [P.], seq 1:105, ack 1, win 507, options [nop,nop,TS val 1697636013 ecr 2973951885], length 104
22:34:59.253903 IP 10.244.0.176.5000 > tesis-PC.52822: Flags [.], ack 105, win 502, options [nop,nop,TS val 2973951886 ecr 1697636013], length 0
22:34:59.254849 IP 10.244.0.176.5000 > tesis-PC.52822: Flags [P.], seq 1:1434, ack 105, win 502, options [nop,nop,TS val 2973951887 ecr 1697636013], length 1433
22:34:59.254879 IP tesis-PC.52822 > 10.244.0.176.5000: Flags [.], ack 1434, win 502, options [nop,nop,TS val 1697636014 ecr 2973951887], length 0
22:34:59.255106 IP 10.244.0.176.5000 > tesis-PC.52822: Flags [F.], seq 1434, ack 105, win 502, options [nop,nop,TS val 2973951887 ecr 1697636014], length 0
22:34:59.255394 IP tesis-PC.52822 > 10.244.0.176.5000: Flags [F.], seq 105, ack 1435, win 502, options [nop,nop,TS val 1697636014 ecr 2973951887], length 0
22:34:59.255471 IP 10.244.0.176.5000 > tesis-PC.52822: Flags [.], ack 106, win 502, options [nop,nop,TS val 2973951887 ecr 1697636014], length 0
22:34:59.368502 IP 10.96.0.1.https > 10.244.0.158.39044: Flags [P.], seq 3474979564:3474979721, ack 2773438671, win 501, options [nop,nop,TS val 3452622356 ecr 3320300823], length 157
22:34:59.368614 IP 10.244.0.158.39044 > tesis-PC.6443: Flags [.], ack 3474979721, win 502, options [nop,nop,TS val 3320321171 ecr 3452622356], length 0
22:34:59.395333 IP 10.96.0.1.https > 10.244.0.159.55204: Flags [P.], seq 13197:13395, ack 5446, win 501, options [nop,nop,TS val 2544398381 ecr 2061578574], length 198
22:34:59.437632 IP 10.244.0.159.55204 > tesis-PC.6443: Flags [.], ack 13396, win 10142, options [nop,nop,TS val 2061579362 ecr 2544398381], length 0
22:34:59.566079 IP 10.244.0.162.27017 > 10.244.0.167.34712: Flags [P.], seq 2608533904:2608534208, ack 3642522941, win 501, options [nop,nop,TS val 2116593834 ecr 3468836484], length 304
22:34:59.566172 IP 10.244.0.167.34712 > 10.244.0.162.27017: Flags [.], ack 304, win 2260, options [nop,nop,TS val 3468846496 ecr 2116593834], length 0
22:34:59.566178 IP 10.244.0.167.34712 > 10.244.0.162.27017: Flags [.], ack 304, win 2260, options [nop,nop,TS val 3468846496 ecr 2116593834], length 0
22:34:59.846223 IP 10.244.0.178.36746 > 10.244.0.177.4997: UDP, length 25
22:34:59.846232 IP 10.244.0.178.36746 > 10.244.0.177.4997: UDP, length 25
22:34:59.846426 IP 10.244.0.177.4997 > 10.244.0.178.36746: UDP, length 17
22:34:59.846509 IP 10.244.0.177.4997 > 10.244.0.178.36746: UDP, length 17
22:34:59.918709 IP tesis-PC.33104 > 10.244.0.156.8181: Flags [S], seq 1397164664, win 64860, options [mss 1410,sackOK,TS val 3193725925 ecr 0,nop,wscale 7], length 0
22:34:59.918717 IP tesis-PC.57342 > 10.244.0.156.http-alt: Flags [S], seq 2112183307, win 64860, options [mss 1410,sackOK,TS val 3193725925 ecr 0,nop,wscale 7], length 0
22:34:59.918782 IP 10.244.0.156.8181 > tesis-PC.33104: Flags [S.], seq 1072333357, ack 1397164665, win 64308, options [mss 1410,sackOK,TS val 478345250 ecr 3193725925,nop,wscale 7], length 0
22:34:59.918793 IP 10.244.0.156.http-alt > tesis-PC.57342: Flags [S.], seq 940344584, ack 2112183308, win 64308, options [mss 1410,sackOK,TS val 478345250 ecr 3193725925,nop,wscale 7], length 0
22:34:59.918812 IP tesis-PC.57342 > 10.244.0.156.http-alt: Flags [.], ack 1, win 507, options [nop,nop,TS val 3193725925 ecr 478345250], length 0
22:34:59.918825 IP tesis-PC.33104 > 10.244.0.156.8181: Flags [.], ack 1, win 507, options [nop,nop,TS val 3193725925 ecr 478345250], length 0
22:34:59.919405 IP tesis-PC.57342 > 10.244.0.156.http-alt: Flags [P.], seq 1:111, ack 1, win 507, options [nop,nop,TS val 3193725925 ecr 478345250], length 110: HTTP: GET /health HTTP/1.1
22:34:59.919412 IP tesis-PC.33104 > 10.244.0.156.8181: Flags [P.], seq 1:110, ack 1, win 507, options [nop,nop,TS val 3193725925 ecr 478345250], length 109
22:34:59.919470 IP 10.244.0.156.http-alt > tesis-PC.57342: Flags [.], ack 111, win 502, options [nop,nop,TS val 478345250 ecr 3193725925], length 0
22:34:59.919472 IP 10.244.0.156.8181 > tesis-PC.33104: Flags [.], ack 110, win 502, options [nop,nop,TS val 478345250 ecr 3193725925], length 0
22:34:59.919781 IP 10.244.0.156.http-alt > tesis-PC.57342: Flags [P.], seq 1:138, ack 111, win 502, options [nop,nop,TS val 478345251 ecr 3193725925], length 137: HTTP: HTTP/1.1 200 OK
22:34:59.919796 IP 10.244.0.156.8181 > tesis-PC.33104: Flags [P.], seq 1:138, ack 110, win 502, options [nop,nop,TS val 478345251 ecr 3193725925], length 137
22:34:59.919803 IP tesis-PC.57342 > 10.244.0.156.http-alt: Flags [.], ack 138, win 506, options [nop,nop,TS val 3193725926 ecr 478345251], length 0
22:34:59.919837 IP tesis-PC.33104 > 10.244.0.156.8181: Flags [.], ack 138, win 506, options [nop,nop,TS val 3193725926 ecr 478345251], length 0
22:34:59.919935 IP 10.244.0.156.http-alt > tesis-PC.57342: Flags [F.], seq 138, ack 111, win 502, options [nop,nop,TS val 478345251 ecr 3193725926], length 0
22:34:59.920004 IP 10.244.0.156.8181 > tesis-PC.33104: Flags [F.], seq 138, ack 110, win 502, options [nop,nop,TS val 478345251 ecr 3193725926], length 0
22:34:59.920198 IP tesis-PC.33104 > 10.244.0.156.8181: Flags [F.], seq 110, ack 139, win 506, options [nop,nop,TS val 3193725926 ecr 478345251], length 0
22:34:59.920198 IP tesis-PC.57342 > 10.244.0.156.http-alt: Flags [F.], seq 111, ack 139, win 506, options [nop,nop,TS val 3193725926 ecr 478345251], length 0
22:34:59.920263 IP 10.244.0.156.http-alt > tesis-PC.57342: Flags [.], ack 112, win 502, options [nop,nop,TS val 478345251 ecr 3193725926], length 0
22:34:59.920278 IP 10.244.0.156.8181 > tesis-PC.33104: Flags [.], ack 111, win 502, options [nop,nop,TS val 478345251 ecr 3193725926], length 0
22:35:00.198819 IP tesis-PC.36842 > 10.244.0.157.8181: Flags [S], seq 1985990307, win 64860, options [mss 1410,sackOK,TS val 2362516305 ecr 0,nop,wscale 7], length 0
22:35:00.198825 IP tesis-PC.39428 > 10.244.0.157.http-alt: Flags [S], seq 1096267882, win 64860, options [mss 1410,sackOK,TS val 2362516305 ecr 0,nop,wscale 7], length 0
22:35:00.198891 IP 10.244.0.157.8181 > tesis-PC.36842: Flags [S.], seq 3849909431, ack 1985990308, win 64308, options [mss 1410,sackOK,TS val 1017834188 ecr 2362516305,nop,wscale 7], length 0
22:35:00.198892 IP 10.244.0.157.http-alt > tesis-PC.39428: Flags [S.], seq 863345218, ack 1096267883, win 64308, options [mss 1410,sackOK,TS val 1017834188 ecr 2362516305,nop,wscale 7], length 0
22:35:00.198917 IP tesis-PC.39428 > 10.244.0.157.http-alt: Flags [.], ack 1, win 507, options [nop,nop,TS val 2362516305 ecr 1017834188], length 0
22:35:00.198929 IP tesis-PC.36842 > 10.244.0.157.8181: Flags [.], ack 1, win 507, options [nop,nop,TS val 2362516305 ecr 1017834188], length 0
22:35:00.199230 IP tesis-PC.39428 > 10.244.0.157.http-alt: Flags [P.], seq 1:111, ack 1, win 507, options [nop,nop,TS val 2362516305 ecr 1017834188], length 110: HTTP: GET /health HTTP/1.1
22:35:00.199256 IP tesis-PC.36842 > 10.244.0.157.8181: Flags [P.], seq 1:110, ack 1, win 507, options [nop,nop,TS val 2362516305 ecr 1017834188], length 109
22:35:00.199266 IP 10.244.0.157.http-alt > tesis-PC.39428: Flags [.], ack 111, win 502, options [nop,nop,TS val 1017834188 ecr 2362516305], length 0
22:35:00.199306 IP 10.244.0.157.8181 > tesis-PC.36842: Flags [.], ack 110, win 502, options [nop,nop,TS val 1017834188 ecr 2362516305], length 0
22:35:00.199514 IP 10.244.0.157.8181 > tesis-PC.36842: Flags [P.], seq 1:138, ack 110, win 502, options [nop,nop,TS val 1017834188 ecr 2362516305], length 137
22:35:00.199517 IP 10.244.0.157.http-alt > tesis-PC.39428: Flags [P.], seq 1:138, ack 111, win 502, options [nop,nop,TS val 1017834188 ecr 2362516305], length 137: HTTP: HTTP/1.1 200 OK
22:35:00.199536 IP tesis-PC.39428 > 10.244.0.157.http-alt: Flags [.], ack 138, win 506, options [nop,nop,TS val 2362516306 ecr 1017834188], length 0
22:35:00.199544 IP tesis-PC.36842 > 10.244.0.157.8181: Flags [.], ack 138, win 506, options [nop,nop,TS val 2362516306 ecr 1017834188], length 0
