21:05:26.265658 IP 10.244.0.202.40140 > nodemaster.6443: Flags [P.], seq 1680152098:1680152137, ack 638553545, win 2096, options [nop,nop,TS val 3639985392 ecr 1510161816], length 39
21:05:26.265782 IP 10.96.0.1.https > 10.244.0.202.40140: Flags [.], ack 1680152137, win 501, options [nop,nop,TS val 1510191817 ecr 3639985392], length 0
21:05:26.266016 IP 10.96.0.1.https > 10.244.0.202.40140: Flags [P.], seq 0:39, ack 1, win 501, options [nop,nop,TS val 1510191817 ecr 3639985392], length 39
21:05:26.266052 IP 10.244.0.202.40140 > nodemaster.6443: Flags [.], ack 40, win 2096, options [nop,nop,TS val 3639985392 ecr 1510191817], length 0
21:05:26.358641 IP nodemaster.60644 > 10.244.0.198.8181: Flags [S], seq 2540721621, win 64860, options [mss 1410,sackOK,TS val 1603745020 ecr 0,nop,wscale 7], length 0
21:05:26.358756 IP 10.244.0.198.8181 > nodemaster.60644: Flags [S.], seq 3305737169, ack 2540721622, win 64308, options [mss 1410,sackOK,TS val 2029869094 ecr 1603745020,nop,wscale 7], length 0
21:05:26.358822 IP nodemaster.60644 > 10.244.0.198.8181: Flags [.], ack 1, win 507, options [nop,nop,TS val 1603745020 ecr 2029869094], length 0
21:05:26.359507 IP nodemaster.60644 > 10.244.0.198.8181: Flags [P.], seq 1:110, ack 1, win 507, options [nop,nop,TS val 1603745021 ecr 2029869094], length 109
21:05:26.359586 IP 10.244.0.198.8181 > nodemaster.60644: Flags [.], ack 110, win 502, options [nop,nop,TS val 2029869095 ecr 1603745021], length 0
21:05:26.359876 IP 10.244.0.198.8181 > nodemaster.60644: Flags [P.], seq 1:138, ack 110, win 502, options [nop,nop,TS val 2029869095 ecr 1603745021], length 137
21:05:26.359930 IP nodemaster.60644 > 10.244.0.198.8181: Flags [.], ack 138, win 506, options [nop,nop,TS val 1603745021 ecr 2029869095], length 0
21:05:26.360069 IP 10.244.0.198.8181 > nodemaster.60644: Flags [F.], seq 138, ack 110, win 502, options [nop,nop,TS val 2029869096 ecr 1603745021], length 0
21:05:26.360543 IP nodemaster.60644 > 10.244.0.198.8181: Flags [F.], seq 110, ack 139, win 506, options [nop,nop,TS val 1603745022 ecr 2029869096], length 0
21:05:26.360616 IP 10.244.0.198.8181 > nodemaster.60644: Flags [.], ack 111, win 502, options [nop,nop,TS val 2029869096 ecr 1603745022], length 0
21:05:26.385691 IP 10.244.0.181.35026 > nodemaster.6443: Flags [P.], seq 3799280796:3799280835, ack 3697782918, win 10482, options [nop,nop,TS val 1762598120 ecr 2336530292], length 39
21:05:26.385849 IP 10.96.0.1.https > 10.244.0.181.35026: Flags [.], ack 3799280835, win 9693, options [nop,nop,TS val 2336532293 ecr 1762598120], length 0
21:05:26.394236 IP 10.96.0.1.https > 10.244.0.181.35026: Flags [P.], seq 0:89, ack 1, win 9693, options [nop,nop,TS val 2336532302 ecr 1762598120], length 89
21:05:26.394422 IP 10.96.0.1.https > 10.244.0.181.35026: Flags [P.], seq 89:880, ack 1, win 9693, options [nop,nop,TS val 2336532302 ecr 1762598120], length 791
21:05:26.394470 IP 10.244.0.181.35026 > nodemaster.6443: Flags [.], ack 881, win 10482, options [nop,nop,TS val 1762598129 ecr 2336532302], length 0
21:05:26.395632 IP 10.244.0.181.35026 > nodemaster.6443: Flags [P.], seq 39:78, ack 881, win 10482, options [nop,nop,TS val 1762598130 ecr 2336532302], length 39
21:05:26.395715 IP 10.96.0.1.https > 10.244.0.181.35026: Flags [.], ack 40, win 9693, options [nop,nop,TS val 2336532303 ecr 1762598130], length 0
21:05:26.401755 IP 10.96.0.1.https > 10.244.0.181.35026: Flags [P.], seq 880:946, ack 40, win 9693, options [nop,nop,TS val 2336532309 ecr 1762598130], length 66
21:05:26.401945 IP 10.96.0.1.https > 10.244.0.181.35026: Flags [P.], seq 946:1749, ack 40, win 9693, options [nop,nop,TS val 2336532309 ecr 1762598130], length 803
21:05:26.402009 IP 10.244.0.181.35026 > nodemaster.6443: Flags [.], ack 1750, win 10482, options [nop,nop,TS val 1762598136 ecr 2336532309], length 0
21:05:26.403176 IP 10.244.0.181.35026 > nodemaster.6443: Flags [P.], seq 78:119, ack 1750, win 10482, options [nop,nop,TS val 1762598138 ecr 2336532309], length 41
21:05:26.403256 IP 10.96.0.1.https > 10.244.0.181.35026: Flags [.], ack 81, win 9693, options [nop,nop,TS val 2336532311 ecr 1762598138], length 0
21:05:26.403359 IP 10.244.0.181.35026 > nodemaster.6443: Flags [P.], seq 119:910, ack 1750, win 10482, options [nop,nop,TS val 1762598138 ecr 2336532311], length 791
21:05:26.403387 IP 10.96.0.1.https > 10.244.0.181.35026: Flags [.], ack 872, win 9693, options [nop,nop,TS val 2336532311 ecr 1762598138], length 0
21:05:26.415787 IP 10.96.0.1.https > 10.244.0.181.35026: Flags [P.], seq 1749:1941, ack 872, win 9693, options [nop,nop,TS val 2336532323 ecr 1762598138], length 192
21:05:26.415972 IP 10.96.0.1.https > 10.244.0.181.35026: Flags [P.], seq 1941:2732, ack 872, win 9693, options [nop,nop,TS val 2336532323 ecr 1762598138], length 791
21:05:26.416027 IP 10.244.0.181.35026 > nodemaster.6443: Flags [.], ack 2733, win 10482, options [nop,nop,TS val 1762598150 ecr 2336532323], length 0
21:05:26.417115 IP 10.244.0.181.35026 > nodemaster.6443: Flags [P.], seq 910:949, ack 2733, win 10482, options [nop,nop,TS val 1762598152 ecr 2336532323], length 39
21:05:26.417174 IP 10.96.0.1.https > 10.244.0.181.35026: Flags [.], ack 911, win 9693, options [nop,nop,TS val 2336532325 ecr 1762598152], length 0
21:05:26.425083 IP 10.96.0.1.https > 10.244.0.181.35026: Flags [P.], seq 2732:2800, ack 911, win 9693, options [nop,nop,TS val 2336532332 ecr 1762598152], length 68
21:05:26.425296 IP 10.96.0.1.https > 10.244.0.181.35026: Flags [P.], seq 2800:3603, ack 911, win 9693, options [nop,nop,TS val 2336532333 ecr 1762598152], length 803
21:05:26.425347 IP 10.244.0.181.35026 > nodemaster.6443: Flags [.], ack 3604, win 10482, options [nop,nop,TS val 1762598160 ecr 2336532332], length 0
21:05:26.426386 IP 10.244.0.181.35026 > nodemaster.6443: Flags [P.], seq 949:990, ack 3604, win 10482, options [nop,nop,TS val 1762598161 ecr 2336532332], length 41
21:05:26.426473 IP 10.244.0.181.35026 > nodemaster.6443: Flags [P.], seq 990:1793, ack 3604, win 10482, options [nop,nop,TS val 1762598161 ecr 2336532332], length 803
21:05:26.426800 IP 10.96.0.1.https > 10.244.0.181.35026: Flags [.], ack 1755, win 9693, options [nop,nop,TS val 2336532334 ecr 1762598161], length 0
21:05:26.436516 IP 10.96.0.1.https > 10.244.0.181.35026: Flags [P.], seq 3603:3669, ack 1755, win 9693, options [nop,nop,TS val 2336532344 ecr 1762598161], length 66
21:05:26.436790 IP 10.96.0.1.https > 10.244.0.181.35026: Flags [P.], seq 3669:4472, ack 1755, win 9693, options [nop,nop,TS val 2336532344 ecr 1762598161], length 803
21:05:26.436855 IP 10.244.0.181.35026 > nodemaster.6443: Flags [.], ack 4473, win 10482, options [nop,nop,TS val 1762598171 ecr 2336532344], length 0
21:05:26.587997 IP nodemaster.34838 > 10.244.0.198.http-alt: Flags [S], seq 4061302700, win 64860, options [mss 1410,sackOK,TS val 1603745249 ecr 0,nop,wscale 7], length 0
21:05:26.588089 IP 10.244.0.198.http-alt > nodemaster.34838: Flags [S.], seq 510932941, ack 4061302701, win 64308, options [mss 1410,sackOK,TS val 2029869324 ecr 1603745249,nop,wscale 7], length 0
21:05:26.588248 IP nodemaster.34838 > 10.244.0.198.http-alt: Flags [.], ack 1, win 507, options [nop,nop,TS val 1603745250 ecr 2029869324], length 0
21:05:26.588826 IP nodemaster.34838 > 10.244.0.198.http-alt: Flags [P.], seq 1:111, ack 1, win 507, options [nop,nop,TS val 1603745250 ecr 2029869324], length 110: HTTP: GET /health HTTP/1.1
21:05:26.588878 IP 10.244.0.198.http-alt > nodemaster.34838: Flags [.], ack 111, win 502, options [nop,nop,TS val 2029869324 ecr 1603745250], length 0
21:05:26.593133 IP 10.244.0.198.http-alt > nodemaster.34838: Flags [P.], seq 1:138, ack 111, win 502, options [nop,nop,TS val 2029869329 ecr 1603745250], length 137: HTTP: HTTP/1.1 200 OK
21:05:26.593241 IP nodemaster.34838 > 10.244.0.198.http-alt: Flags [.], ack 138, win 506, options [nop,nop,TS val 1603745255 ecr 2029869329], length 0
21:05:26.593385 IP 10.244.0.198.http-alt > nodemaster.34838: Flags [F.], seq 138, ack 111, win 502, options [nop,nop,TS val 2029869329 ecr 1603745255], length 0
21:05:26.594001 IP nodemaster.34838 > 10.244.0.198.http-alt: Flags [F.], seq 111, ack 139, win 506, options [nop,nop,TS val 1603745255 ecr 2029869329], length 0
21:05:26.594049 IP 10.244.0.198.http-alt > nodemaster.34838: Flags [.], ack 112, win 502, options [nop,nop,TS val 2029869329 ecr 1603745255], length 0
21:05:28.440699 IP 10.244.0.181.35026 > nodemaster.6443: Flags [P.], seq 1793:1832, ack 4473, win 10482, options [nop,nop,TS val 1762600175 ecr 2336532344], length 39
21:05:28.445857 IP 10.96.0.1.https > 10.244.0.181.35026: Flags [P.], seq 4472:4565, ack 1794, win 9693, options [nop,nop,TS val 2336534353 ecr 1762600175], length 93
21:05:28.445998 IP 10.96.0.1.https > 10.244.0.181.35026: Flags [P.], seq 4565:5356, ack 1794, win 9693, options [nop,nop,TS val 2336534353 ecr 1762600175], length 791
21:05:28.446039 IP 10.244.0.181.35026 > nodemaster.6443: Flags [.], ack 5357, win 10482, options [nop,nop,TS val 1762600180 ecr 2336534353], length 0
21:05:28.446406 IP 10.244.0.181.35026 > nodemaster.6443: Flags [P.], seq 1832:1867, ack 5357, win 10482, options [nop,nop,TS val 1762600181 ecr 2336534353], length 35
21:05:28.447135 IP 10.244.0.181.35026 > nodemaster.6443: Flags [P.], seq 1867:1906, ack 5357, win 10482, options [nop,nop,TS val 1762600182 ecr 2336534353], length 39
21:05:28.447266 IP 10.96.0.1.https > 10.244.0.181.35026: Flags [.], ack 1868, win 9693, options [nop,nop,TS val 2336534355 ecr 1762600181], length 0
21:05:28.452014 IP 10.96.0.1.https > 10.244.0.181.35026: Flags [P.], seq 5356:5427, ack 1868, win 9693, options [nop,nop,TS val 2336534359 ecr 1762600181], length 71
21:05:28.452287 IP 10.96.0.1.https > 10.244.0.181.35026: Flags [P.], seq 5427:6230, ack 1868, win 9693, options [nop,nop,TS val 2336534360 ecr 1762600181], length 803
21:05:28.452428 IP 10.244.0.181.35026 > nodemaster.6443: Flags [.], ack 6231, win 10482, options [nop,nop,TS val 1762600187 ecr 2336534359], length 0
21:05:28.453480 IP 10.244.0.181.35026 > nodemaster.6443: Flags [P.], seq 1906:1947, ack 6231, win 10482, options [nop,nop,TS val 1762600188 ecr 2336534359], length 41
21:05:28.453627 IP 10.244.0.181.35026 > nodemaster.6443: Flags [P.], seq 1947:2738, ack 6231, win 10482, options [nop,nop,TS val 1762600188 ecr 2336534359], length 791
21:05:28.453756 IP 10.96.0.1.https > 10.244.0.181.35026: Flags [.], ack 2700, win 9693, options [nop,nop,TS val 2336534361 ecr 1762600188], length 0
21:05:28.463480 IP 10.96.0.1.https > 10.244.0.181.35026: Flags [P.], seq 6230:6297, ack 2700, win 9693, options [nop,nop,TS val 2336534371 ecr 1762600188], length 67
21:05:28.463655 IP 10.96.0.1.https > 10.244.0.181.35026: Flags [P.], seq 6297:7088, ack 2700, win 9693, options [nop,nop,TS val 2336534371 ecr 1762600188], length 791
21:05:28.463889 IP 10.244.0.181.35026 > nodemaster.6443: Flags [.], ack 7089, win 10482, options [nop,nop,TS val 1762600198 ecr 2336534371], length 0
21:05:28.464772 IP 10.244.0.181.35026 > nodemaster.6443: Flags [P.], seq 2738:2777, ack 7089, win 10482, options [nop,nop,TS val 1762600199 ecr 2336534371], length 39
21:05:28.469598 IP 10.96.0.1.https > 10.244.0.181.35026: Flags [P.], seq 7088:7154, ack 2739, win 9693, options [nop,nop,TS val 2336534377 ecr 1762600199], length 66
21:05:28.469778 IP 10.96.0.1.https > 10.244.0.181.35026: Flags [P.], seq 7154:7957, ack 2739, win 9693, options [nop,nop,TS val 2336534377 ecr 1762600199], length 803
21:05:28.469844 IP 10.244.0.181.35026 > nodemaster.6443: Flags [.], ack 7958, win 10482, options [nop,nop,TS val 1762600204 ecr 2336534377], length 0
21:05:28.470720 IP 10.244.0.181.35026 > nodemaster.6443: Flags [P.], seq 2777:2818, ack 7958, win 10482, options [nop,nop,TS val 1762600205 ecr 2336534377], length 41
21:05:28.470834 IP 10.244.0.181.35026 > nodemaster.6443: Flags [P.], seq 2818:3621, ack 7958, win 10482, options [nop,nop,TS val 1762600205 ecr 2336534377], length 803
21:05:28.470926 IP 10.96.0.1.https > 10.244.0.181.35026: Flags [.], ack 3583, win 9693, options [nop,nop,TS val 2336534378 ecr 1762600205], length 0
21:05:28.478419 IP 10.96.0.1.https > 10.244.0.181.35026: Flags [P.], seq 7957:8024, ack 3583, win 9693, options [nop,nop,TS val 2336534386 ecr 1762600205], length 67
21:05:28.478617 IP 10.96.0.1.https > 10.244.0.181.35026: Flags [P.], seq 8024:8827, ack 3583, win 9693, options [nop,nop,TS val 2336534386 ecr 1762600205], length 803
21:05:28.478847 IP 10.244.0.181.35026 > nodemaster.6443: Flags [.], ack 8828, win 10482, options [nop,nop,TS val 1762600213 ecr 2336534386], length 0
21:05:28.760854 IP nodemaster.44708 > 10.244.0.202.http-alt: Flags [S], seq 2331299136, win 64860, options [mss 1410,sackOK,TS val 3550547246 ecr 0,nop,wscale 7], length 0
21:05:28.760947 IP 10.244.0.202.http-alt > nodemaster.44708: Flags [S.], seq 1021617272, ack 2331299137, win 64308, options [mss 1410,sackOK,TS val 1618538469 ecr 3550547246,nop,wscale 7], length 0
21:05:28.761010 IP nodemaster.44708 > 10.244.0.202.http-alt: Flags [.], ack 1, win 507, options [nop,nop,TS val 3550547246 ecr 1618538469], length 0
21:05:28.761483 IP nodemaster.44708 > 10.244.0.202.http-alt: Flags [P.], seq 1:111, ack 1, win 507, options [nop,nop,TS val 3550547247 ecr 1618538469], length 110: HTTP: GET /health HTTP/1.1
21:05:28.761604 IP 10.244.0.202.http-alt > nodemaster.44708: Flags [.], ack 111, win 502, options [nop,nop,TS val 1618538470 ecr 3550547247], length 0
21:05:28.761953 IP 10.244.0.202.http-alt > nodemaster.44708: Flags [P.], seq 1:138, ack 111, win 502, options [nop,nop,TS val 1618538470 ecr 3550547247], length 137: HTTP: HTTP/1.1 200 OK
21:05:28.762003 IP nodemaster.44708 > 10.244.0.202.http-alt: Flags [.], ack 138, win 506, options [nop,nop,TS val 3550547247 ecr 1618538470], length 0
21:05:28.762150 IP 10.244.0.202.http-alt > nodemaster.44708: Flags [F.], seq 138, ack 111, win 502, options [nop,nop,TS val 1618538471 ecr 3550547247], length 0
21:05:28.762268 IP nodemaster.44708 > 10.244.0.202.http-alt: Flags [F.], seq 111, ack 139, win 506, options [nop,nop,TS val 3550547248 ecr 1618538471], length 0
21:05:28.762295 IP 10.244.0.202.http-alt > nodemaster.44708: Flags [.], ack 112, win 502, options [nop,nop,TS val 1618538471 ecr 3550547248], length 0
21:05:29.324590 IP 10.96.0.1.https > 10.244.0.202.40140: Flags [P.], seq 39:144, ack 1, win 501, options [nop,nop,TS val 1510194876 ecr 3639985392], length 105
21:05:29.324680 IP 10.244.0.202.40140 > nodemaster.6443: Flags [.], ack 145, win 2096, options [nop,nop,TS val 3639988451 ecr 1510194876], length 0
21:05:29.332628 IP 10.96.0.1.https > 10.244.0.180.54836: Flags [P.], seq 844018205:844018362, ack 376256571, win 501, options [nop,nop,TS val 2741709396 ecr 2055385911], length 157
21:05:29.332710 IP 10.244.0.180.54836 > nodemaster.6443: Flags [.], ack 844018362, win 502, options [nop,nop,TS val 2055399974 ecr 2741709396], length 0
21:05:29.519341 IP 10.96.0.1.https > 10.244.0.181.35026: Flags [P.], seq 8827:9025, ack 3583, win 9693, options [nop,nop,TS val 2336535427 ecr 1762600213], length 198
21:05:29.560745 IP 10.244.0.181.35026 > nodemaster.6443: Flags [.], ack 9026, win 10482, options [nop,nop,TS val 1762601295 ecr 2336535427], length 0
21:05:29.757433 IP nodemaster.39958 > 10.244.0.180.8585: Flags [S], seq 1427793778, win 64860, options [mss 1410,sackOK,TS val 1279512420 ecr 0,nop,wscale 7], length 0
21:05:29.757542 IP 10.244.0.180.8585 > nodemaster.39958: Flags [S.], seq 1989588882, ack 1427793779, win 64308, options [mss 1410,sackOK,TS val 3463332091 ecr 1279512420,nop,wscale 7], length 0
21:05:29.757602 IP nodemaster.39958 > 10.244.0.180.8585: Flags [.], ack 1, win 507, options [nop,nop,TS val 1279512420 ecr 3463332091], length 0
21:05:29.757967 IP nodemaster.39958 > 10.244.0.180.8585: Flags [P.], seq 1:111, ack 1, win 507, options [nop,nop,TS val 1279512420 ecr 3463332091], length 110
21:05:29.757991 IP 10.244.0.180.8585 > nodemaster.39958: Flags [.], ack 111, win 502, options [nop,nop,TS val 3463332091 ecr 1279512420], length 0
21:05:29.758360 IP 10.244.0.180.8585 > nodemaster.39958: Flags [P.], seq 1:171, ack 111, win 502, options [nop,nop,TS val 3463332092 ecr 1279512420], length 170
21:05:29.758402 IP nodemaster.39958 > 10.244.0.180.8585: Flags [.], ack 171, win 506, options [nop,nop,TS val 1279512421 ecr 3463332092], length 0
21:05:29.758591 IP 10.244.0.180.8585 > nodemaster.39958: Flags [F.], seq 171, ack 111, win 502, options [nop,nop,TS val 3463332092 ecr 1279512421], length 0
21:05:29.758676 IP nodemaster.39958 > 10.244.0.180.8585: Flags [F.], seq 111, ack 172, win 506, options [nop,nop,TS val 1279512421 ecr 3463332092], length 0
21:05:29.758715 IP 10.244.0.180.8585 > nodemaster.39958: Flags [.], ack 112, win 502, options [nop,nop,TS val 3463332092 ecr 1279512421], length 0
21:05:30.480587 IP 10.244.0.181.35026 > nodemaster.6443: Flags [P.], seq 3621:3660, ack 9026, win 10482, options [nop,nop,TS val 1762602215 ecr 2336535427], length 39
21:05:30.485936 IP 10.96.0.1.https > 10.244.0.181.35026: Flags [P.], seq 9025:9114, ack 3622, win 9693, options [nop,nop,TS val 2336536393 ecr 1762602215], length 89
21:05:30.485996 IP 10.244.0.181.35026 > nodemaster.6443: Flags [.], ack 9115, win 10482, options [nop,nop,TS val 1762602220 ecr 2336536393], length 0
21:05:30.486156 IP 10.96.0.1.https > 10.244.0.181.35026: Flags [P.], seq 9114:9905, ack 3622, win 9693, options [nop,nop,TS val 2336536394 ecr 1762602220], length 791
21:05:30.486190 IP 10.244.0.181.35026 > nodemaster.6443: Flags [.], ack 9906, win 10482, options [nop,nop,TS val 1762602221 ecr 2336536394], length 0
21:05:30.486741 IP 10.244.0.181.35026 > nodemaster.6443: Flags [P.], seq 3660:3695, ack 9906, win 10482, options [nop,nop,TS val 1762602221 ecr 2336536394], length 35
21:05:30.487387 IP 10.244.0.181.35026 > nodemaster.6443: Flags [P.], seq 3695:3734, ack 9906, win 10482, options [nop,nop,TS val 1762602222 ecr 2336536394], length 39
21:05:30.487527 IP 10.96.0.1.https > 10.244.0.181.35026: Flags [.], ack 3696, win 9693, options [nop,nop,TS val 2336536395 ecr 1762602221], length 0
21:05:30.492285 IP 10.96.0.1.https > 10.244.0.181.35026: Flags [P.], seq 9905:9972, ack 3696, win 9693, options [nop,nop,TS val 2336536400 ecr 1762602221], length 67
21:05:30.492329 IP 10.244.0.181.35026 > nodemaster.6443: Flags [.], ack 9973, win 10482, options [nop,nop,TS val 1762602227 ecr 2336536400], length 0
21:05:30.492427 IP 10.96.0.1.https > 10.244.0.181.35026: Flags [P.], seq 9972:10775, ack 3696, win 9693, options [nop,nop,TS val 2336536400 ecr 1762602227], length 803
21:05:30.492444 IP 10.244.0.181.35026 > nodemaster.6443: Flags [.], ack 10776, win 10482, options [nop,nop,TS val 1762602227 ecr 2336536400], length 0
21:05:30.493485 IP 10.244.0.181.35026 > nodemaster.6443: Flags [P.], seq 3734:3775, ack 10776, win 10482, options [nop,nop,TS val 1762602228 ecr 2336536400], length 41
21:05:30.493585 IP 10.244.0.181.35026 > nodemaster.6443: Flags [P.], seq 3775:4566, ack 10776, win 10482, options [nop,nop,TS val 1762602228 ecr 2336536400], length 791
21:05:30.493834 IP 10.96.0.1.https > 10.244.0.181.35026: Flags [.], ack 4528, win 9693, options [nop,nop,TS val 2336536401 ecr 1762602228], length 0
21:05:30.495202 IP 10.96.0.1.https > 10.244.0.181.35026: Flags [P.], seq 10775:10810, ack 4528, win 9693, options [nop,nop,TS val 2336536403 ecr 1762602228], length 35
21:05:30.495234 IP 10.244.0.181.35026 > nodemaster.6443: Flags [.], ack 10811, win 10482, options [nop,nop,TS val 1762602230 ecr 2336536403], length 0
21:05:30.503774 IP 10.96.0.1.https > 10.244.0.181.35026: Flags [P.], seq 10810:10876, ack 4528, win 9693, options [nop,nop,TS val 2336536411 ecr 1762602230], length 66
21:05:30.503814 IP 10.244.0.181.35026 > nodemaster.6443: Flags [.], ack 10877, win 10482, options [nop,nop,TS val 1762602238 ecr 2336536411], length 0
21:05:30.504038 IP 10.96.0.1.https > 10.244.0.181.35026: Flags [P.], seq 10876:11667, ack 4528, win 9693, options [nop,nop,TS val 2336536411 ecr 1762602238], length 791
21:05:30.504050 IP 10.244.0.181.35026 > nodemaster.6443: Flags [.], ack 11668, win 10482, options [nop,nop,TS val 1762602238 ecr 2336536411], length 0
21:05:30.504953 IP 10.244.0.181.35026 > nodemaster.6443: Flags [P.], seq 4566:4605, ack 11668, win 10482, options [nop,nop,TS val 1762602239 ecr 2336536411], length 39
21:05:30.511039 IP 10.96.0.1.https > 10.244.0.181.35026: Flags [P.], seq 11667:11733, ack 4567, win 9693, options [nop,nop,TS val 2336536418 ecr 1762602239], length 66
21:05:30.511149 IP 10.96.0.1.https > 10.244.0.181.35026: Flags [P.], seq 11733:12536, ack 4567, win 9693, options [nop,nop,TS val 2336536419 ecr 1762602239], length 803
21:05:30.511221 IP 10.244.0.181.35026 > nodemaster.6443: Flags [.], ack 12537, win 10482, options [nop,nop,TS val 1762602246 ecr 2336536418], length 0
21:05:30.512183 IP 10.244.0.181.35026 > nodemaster.6443: Flags [P.], seq 4605:4646, ack 12537, win 10482, options [nop,nop,TS val 1762602247 ecr 2336536418], length 41
21:05:30.512274 IP 10.244.0.181.35026 > nodemaster.6443: Flags [P.], seq 4646:5449, ack 12537, win 10482, options [nop,nop,TS val 1762602247 ecr 2336536418], length 803
21:05:30.512351 IP 10.96.0.1.https > 10.244.0.181.35026: Flags [.], ack 5411, win 9693, options [nop,nop,TS val 2336536420 ecr 1762602247], length 0
21:05:30.521510 IP 10.96.0.1.https > 10.244.0.181.35026: Flags [P.], seq 12536:12603, ack 5411, win 9693, options [nop,nop,TS val 2336536429 ecr 1762602247], length 67
21:05:30.521682 IP 10.96.0.1.https > 10.244.0.181.35026: Flags [P.], seq 12603:13406, ack 5411, win 9693, options [nop,nop,TS val 2336536429 ecr 1762602247], length 803
21:05:30.521747 IP 10.244.0.181.35026 > nodemaster.6443: Flags [.], ack 13407, win 10482, options [nop,nop,TS val 1762602256 ecr 2336536429], length 0
21:05:32.523227 IP 10.244.0.181.35026 > nodemaster.6443: Flags [P.], seq 5449:5488, ack 13407, win 10482, options [nop,nop,TS val 1762604258 ecr 2336536429], length 39
21:05:32.528477 IP 10.96.0.1.https > 10.244.0.181.35026: Flags [P.], seq 13406:13495, ack 5450, win 9693, options [nop,nop,TS val 2336538436 ecr 1762604258], length 89
21:05:32.528725 IP 10.96.0.1.https > 10.244.0.181.35026: Flags [P.], seq 13495:14286, ack 5450, win 9693, options [nop,nop,TS val 2336538436 ecr 1762604258], length 791
21:05:32.529148 IP 10.244.0.181.35026 > nodemaster.6443: Flags [.], ack 14287, win 10482, options [nop,nop,TS val 1762604264 ecr 2336538436], length 0
21:05:32.530206 IP 10.244.0.181.35026 > nodemaster.6443: Flags [P.], seq 5488:5527, ack 14287, win 10482, options [nop,nop,TS val 1762604265 ecr 2336538436], length 39
21:05:32.535352 IP 10.96.0.1.https > 10.244.0.181.35026: Flags [P.], seq 14286:14353, ack 5489, win 9693, options [nop,nop,TS val 2336538443 ecr 1762604265], length 67
21:05:32.535480 IP 10.96.0.1.https > 10.244.0.181.35026: Flags [P.], seq 14353:15156, ack 5489, win 9693, options [nop,nop,TS val 2336538443 ecr 1762604265], length 803
21:05:32.535617 IP 10.244.0.181.35026 > nodemaster.6443: Flags [.], ack 15157, win 10482, options [nop,nop,TS val 1762604270 ecr 2336538443], length 0
21:05:32.536172 IP 10.244.0.181.35026 > nodemaster.6443: Flags [P.], seq 5527:5562, ack 15157, win 10482, options [nop,nop,TS val 1762604271 ecr 2336538443], length 35
21:05:32.537045 IP 10.244.0.181.35026 > nodemaster.6443: Flags [P.], seq 5562:5603, ack 15157, win 10482, options [nop,nop,TS val 1762604271 ecr 2336538443], length 41
21:05:32.537136 IP 10.244.0.181.35026 > nodemaster.6443: Flags [P.], seq 5603:6394, ack 15157, win 10482, options [nop,nop,TS val 1762604272 ecr 2336538443], length 791
21:05:32.537192 IP 10.96.0.1.https > 10.244.0.181.35026: Flags [.], ack 6356, win 9693, options [nop,nop,TS val 2336538445 ecr 1762604271], length 0
21:05:32.546605 IP 10.96.0.1.https > 10.244.0.181.35026: Flags [P.], seq 15156:15222, ack 6356, win 9693, options [nop,nop,TS val 2336538454 ecr 1762604271], length 66
21:05:32.546730 IP 10.96.0.1.https > 10.244.0.181.35026: Flags [P.], seq 15222:16013, ack 6356, win 9693, options [nop,nop,TS val 2336538454 ecr 1762604271], length 791
21:05:32.546801 IP 10.244.0.181.35026 > nodemaster.6443: Flags [.], ack 16014, win 10482, options [nop,nop,TS val 1762604281 ecr 2336538454], length 0
21:05:32.547634 IP 10.244.0.181.35026 > nodemaster.6443: Flags [P.], seq 6394:6433, ack 16014, win 10482, options [nop,nop,TS val 1762604282 ecr 2336538454], length 39
21:05:32.552124 IP 10.96.0.1.https > 10.244.0.181.35026: Flags [P.], seq 16013:16079, ack 6395, win 9693, options [nop,nop,TS val 2336538459 ecr 1762604282], length 66
21:05:32.552309 IP 10.96.0.1.https > 10.244.0.181.35026: Flags [P.], seq 16079:16882, ack 6395, win 9693, options [nop,nop,TS val 2336538460 ecr 1762604282], length 803
21:05:32.552489 IP 10.244.0.181.35026 > nodemaster.6443: Flags [.], ack 16883, win 10482, options [nop,nop,TS val 1762604287 ecr 2336538459], length 0
21:05:32.553226 IP 10.244.0.181.35026 > nodemaster.6443: Flags [P.], seq 6433:6474, ack 16883, win 10482, options [nop,nop,TS val 1762604288 ecr 2336538459], length 41
21:05:32.553301 IP 10.244.0.181.35026 > nodemaster.6443: Flags [P.], seq 6474:7277, ack 16883, win 10482, options [nop,nop,TS val 1762604288 ecr 2336538459], length 803
21:05:32.553333 IP 10.96.0.1.https > 10.244.0.181.35026: Flags [.], ack 7239, win 9693, options [nop,nop,TS val 2336538461 ecr 1762604288], length 0
21:05:32.562185 IP 10.96.0.1.https > 10.244.0.181.35026: Flags [P.], seq 16882:16948, ack 7239, win 9693, options [nop,nop,TS val 2336538470 ecr 1762604288], length 66
21:05:32.562313 IP 10.96.0.1.https > 10.244.0.181.35026: Flags [P.], seq 16948:17751, ack 7239, win 9693, options [nop,nop,TS val 2336538470 ecr 1762604288], length 803
21:05:32.562349 IP 10.244.0.181.35026 > nodemaster.6443: Flags [.], ack 17752, win 10482, options [nop,nop,TS val 1762604297 ecr 2336538470], length 0
21:05:34.565024 IP 10.244.0.181.35026 > nodemaster.6443: Flags [P.], seq 7277:7316, ack 17752, win 10482, options [nop,nop,TS val 1762606299 ecr 2336538470], length 39
21:05:34.569876 IP 10.96.0.1.https > 10.244.0.181.35026: Flags [P.], seq 17751:17840, ack 7278, win 9693, options [nop,nop,TS val 2336540477 ecr 1762606299], length 89
21:05:34.570019 IP 10.96.0.1.https > 10.244.0.181.35026: Flags [P.], seq 17840:18631, ack 7278, win 9693, options [nop,nop,TS val 2336540477 ecr 1762606299], length 791
21:05:34.570089 IP 10.244.0.181.35026 > nodemaster.6443: Flags [.], ack 18632, win 10482, options [nop,nop,TS val 1762606305 ecr 2336540477], length 0
21:05:34.571025 IP 10.244.0.181.35026 > nodemaster.6443: Flags [P.], seq 7316:7355, ack 18632, win 10482, options [nop,nop,TS val 1762606305 ecr 2336540477], length 39
21:05:34.575195 IP 10.96.0.1.https > 10.244.0.181.35026: Flags [P.], seq 18631:18698, ack 7317, win 9693, options [nop,nop,TS val 2336540483 ecr 1762606305], length 67
21:05:34.575326 IP 10.96.0.1.https > 10.244.0.181.35026: Flags [P.], seq 18698:19501, ack 7317, win 9693, options [nop,nop,TS val 2336540483 ecr 1762606305], length 803
21:05:34.575359 IP 10.244.0.181.35026 > nodemaster.6443: Flags [.], ack 19502, win 10482, options [nop,nop,TS val 1762606310 ecr 2336540483], length 0
21:05:34.575722 IP 10.244.0.181.35026 > nodemaster.6443: Flags [P.], seq 7355:7390, ack 19502, win 10482, options [nop,nop,TS val 1762606310 ecr 2336540483], length 35
21:05:34.576449 IP 10.244.0.181.35026 > nodemaster.6443: Flags [P.], seq 7390:7431, ack 19502, win 10482, options [nop,nop,TS val 1762606311 ecr 2336540483], length 41
21:05:34.576529 IP 10.244.0.181.35026 > nodemaster.6443: Flags [P.], seq 7431:8222, ack 19502, win 10482, options [nop,nop,TS val 1762606311 ecr 2336540483], length 791
21:05:34.576605 IP 10.96.0.1.https > 10.244.0.181.35026: Flags [.], ack 7393, win 9693, options [nop,nop,TS val 2336540484 ecr 1762606310], length 0
21:05:34.587480 IP 10.96.0.1.https > 10.244.0.181.35026: Flags [P.], seq 19501:19568, ack 8184, win 9693, options [nop,nop,TS val 2336540495 ecr 1762606311], length 67
21:05:34.587640 IP 10.96.0.1.https > 10.244.0.181.35026: Flags [P.], seq 19568:20359, ack 8184, win 9693, options [nop,nop,TS val 2336540495 ecr 1762606311], length 791
21:05:34.587670 IP 10.244.0.181.35026 > nodemaster.6443: Flags [.], ack 20360, win 10482, options [nop,nop,TS val 1762606322 ecr 2336540495], length 0
21:05:34.588661 IP 10.244.0.181.35026 > nodemaster.6443: Flags [P.], seq 8222:8261, ack 20360, win 10482, options [nop,nop,TS val 1762606323 ecr 2336540495], length 39
21:05:34.595314 IP 10.96.0.1.https > 10.244.0.181.35026: Flags [P.], seq 20359:20425, ack 8223, win 9693, options [nop,nop,TS val 2336540503 ecr 1762606323], length 66
21:05:34.595481 IP 10.96.0.1.https > 10.244.0.181.35026: Flags [P.], seq 20425:21228, ack 8223, win 9693, options [nop,nop,TS val 2336540503 ecr 1762606323], length 803
21:05:34.595651 IP 10.244.0.181.35026 > nodemaster.6443: Flags [.], ack 21229, win 10482, options [nop,nop,TS val 1762606330 ecr 2336540503], length 0
21:05:34.597096 IP 10.244.0.181.35026 > nodemaster.6443: Flags [P.], seq 8261:8302, ack 21229, win 10482, options [nop,nop,TS val 1762606332 ecr 2336540503], length 41
21:05:34.597248 IP 10.244.0.181.35026 > nodemaster.6443: Flags [P.], seq 8302:9105, ack 21229, win 10482, options [nop,nop,TS val 1762606332 ecr 2336540503], length 803
21:05:34.597320 IP 10.96.0.1.https > 10.244.0.181.35026: Flags [.], ack 9067, win 9693, options [nop,nop,TS val 2336540505 ecr 1762606332], length 0
21:05:34.621550 IP 10.96.0.1.https > 10.244.0.181.35026: Flags [P.], seq 21228:21294, ack 9067, win 9693, options [nop,nop,TS val 2336540529 ecr 1762606332], length 66
21:05:34.621723 IP 10.96.0.1.https > 10.244.0.181.35026: Flags [P.], seq 21294:22097, ack 9067, win 9693, options [nop,nop,TS val 2336540529 ecr 1762606332], length 803
21:05:34.621796 IP 10.244.0.181.35026 > nodemaster.6443: Flags [.], ack 22098, win 10482, options [nop,nop,TS val 1762606356 ecr 2336540529], length 0
21:05:35.565841 IP nodemaster.59888 > 10.244.0.202.8181: Flags [S], seq 4087333775, win 64860, options [mss 1410,sackOK,TS val 3550554051 ecr 0,nop,wscale 7], length 0
21:05:35.565928 IP 10.244.0.202.8181 > nodemaster.59888: Flags [S.], seq 2586708542, ack 4087333776, win 64308, options [mss 1410,sackOK,TS val 1618545274 ecr 3550554051,nop,wscale 7], length 0
21:05:35.565988 IP nodemaster.59888 > 10.244.0.202.8181: Flags [.], ack 1, win 507, options [nop,nop,TS val 3550554051 ecr 1618545274], length 0
21:05:35.566454 IP nodemaster.59888 > 10.244.0.202.8181: Flags [P.], seq 1:110, ack 1, win 507, options [nop,nop,TS val 3550554052 ecr 1618545274], length 109
21:05:35.566498 IP 10.244.0.202.8181 > nodemaster.59888: Flags [.], ack 110, win 502, options [nop,nop,TS val 1618545275 ecr 3550554052], length 0
21:05:35.566792 IP 10.244.0.202.8181 > nodemaster.59888: Flags [P.], seq 1:138, ack 110, win 502, options [nop,nop,TS val 1618545275 ecr 3550554052], length 137
21:05:35.566827 IP nodemaster.59888 > 10.244.0.202.8181: Flags [.], ack 138, win 506, options [nop,nop,TS val 3550554052 ecr 1618545275], length 0
21:05:35.566936 IP 10.244.0.202.8181 > nodemaster.59888: Flags [F.], seq 138, ack 110, win 502, options [nop,nop,TS val 1618545275 ecr 3550554052], length 0
21:05:35.567052 IP nodemaster.59888 > 10.244.0.202.8181: Flags [F.], seq 110, ack 139, win 506, options [nop,nop,TS val 3550554052 ecr 1618545275], length 0
21:05:35.567091 IP 10.244.0.202.8181 > nodemaster.59888: Flags [.], ack 111, win 502, options [nop,nop,TS val 1618545276 ecr 3550554052], length 0
21:05:36.000719 IP 10.96.0.1.https > 10.244.0.184.55886: Flags [P.], seq 2508056213:2508056318, ack 2437539100, win 501, options [nop,nop,TS val 544982480 ecr 1702696433], length 105
21:05:36.000791 IP 10.244.0.184.55886 > nodemaster.6443: Flags [.], ack 2508056318, win 7990, options [nop,nop,TS val 1702711709 ecr 544982480], length 0
21:05:36.358641 IP nodemaster.38648 > 10.244.0.198.8181: Flags [S], seq 3649329681, win 64860, options [mss 1410,sackOK,TS val 1603755020 ecr 0,nop,wscale 7], length 0
21:05:36.358719 IP 10.244.0.198.8181 > nodemaster.38648: Flags [S.], seq 1915636930, ack 3649329682, win 64308, options [mss 1410,sackOK,TS val 2029879094 ecr 1603755020,nop,wscale 7], length 0
21:05:36.358767 IP nodemaster.38648 > 10.244.0.198.8181: Flags [.], ack 1, win 507, options [nop,nop,TS val 1603755020 ecr 2029879094], length 0
21:05:36.359237 IP nodemaster.38648 > 10.244.0.198.8181: Flags [P.], seq 1:110, ack 1, win 507, options [nop,nop,TS val 1603755021 ecr 2029879094], length 109
21:05:36.359273 IP 10.244.0.198.8181 > nodemaster.38648: Flags [.], ack 110, win 502, options [nop,nop,TS val 2029879095 ecr 1603755021], length 0
21:05:36.359566 IP 10.244.0.198.8181 > nodemaster.38648: Flags [P.], seq 1:138, ack 110, win 502, options [nop,nop,TS val 2029879095 ecr 1603755021], length 137
21:05:36.359619 IP nodemaster.38648 > 10.244.0.198.8181: Flags [.], ack 138, win 506, options [nop,nop,TS val 1603755021 ecr 2029879095], length 0
21:05:36.359842 IP 10.244.0.198.8181 > nodemaster.38648: Flags [F.], seq 138, ack 110, win 502, options [nop,nop,TS val 2029879095 ecr 1603755021], length 0
21:05:36.359888 IP nodemaster.38648 > 10.244.0.198.8181: Flags [F.], seq 110, ack 138, win 506, options [nop,nop,TS val 1603755021 ecr 2029879095], length 0
21:05:36.359914 IP 10.244.0.198.8181 > nodemaster.38648: Flags [.], ack 111, win 502, options [nop,nop,TS val 2029879095 ecr 1603755021], length 0
21:05:36.359964 IP nodemaster.38648 > 10.244.0.198.8181: Flags [.], ack 139, win 506, options [nop,nop,TS val 1603755021 ecr 2029879095], length 0
21:05:36.588080 IP nodemaster.45086 > 10.244.0.198.http-alt: Flags [S], seq 1828545362, win 64860, options [mss 1410,sackOK,TS val 1603755249 ecr 0,nop,wscale 7], length 0
21:05:36.588155 IP 10.244.0.198.http-alt > nodemaster.45086: Flags [S.], seq 2509798341, ack 1828545363, win 64308, options [mss 1410,sackOK,TS val 2029879324 ecr 1603755249,nop,wscale 7], length 0
21:05:36.588213 IP nodemaster.45086 > 10.244.0.198.http-alt: Flags [.], ack 1, win 507, options [nop,nop,TS val 1603755250 ecr 2029879324], length 0
21:05:36.588689 IP nodemaster.45086 > 10.244.0.198.http-alt: Flags [P.], seq 1:111, ack 1, win 507, options [nop,nop,TS val 1603755250 ecr 2029879324], length 110: HTTP: GET /health HTTP/1.1
21:05:36.588745 IP 10.244.0.198.http-alt > nodemaster.45086: Flags [.], ack 111, win 502, options [nop,nop,TS val 2029879324 ecr 1603755250], length 0
21:05:36.588957 IP 10.244.0.198.http-alt > nodemaster.45086: Flags [P.], seq 1:138, ack 111, win 502, options [nop,nop,TS val 2029879324 ecr 1603755250], length 137: HTTP: HTTP/1.1 200 OK
21:05:36.588997 IP nodemaster.45086 > 10.244.0.198.http-alt: Flags [.], ack 138, win 506, options [nop,nop,TS val 1603755250 ecr 2029879324], length 0
21:05:36.589196 IP 10.244.0.198.http-alt > nodemaster.45086: Flags [F.], seq 138, ack 111, win 502, options [nop,nop,TS val 2029879325 ecr 1603755250], length 0
21:05:36.589371 IP nodemaster.45086 > 10.244.0.198.http-alt: Flags [F.], seq 111, ack 139, win 506, options [nop,nop,TS val 1603755251 ecr 2029879325], length 0
21:05:36.589427 IP 10.244.0.198.http-alt > nodemaster.45086: Flags [.], ack 112, win 502, options [nop,nop,TS val 2029879325 ecr 1603755251], length 0
21:05:36.623859 IP 10.244.0.181.35026 > nodemaster.6443: Flags [P.], seq 9105:9144, ack 22098, win 10482, options [nop,nop,TS val 1762608358 ecr 2336540529], length 39
21:05:36.631359 IP 10.96.0.1.https > 10.244.0.181.35026: Flags [P.], seq 22097:22186, ack 9106, win 9693, options [nop,nop,TS val 2336542539 ecr 1762608358], length 89
21:05:36.631616 IP 10.96.0.1.https > 10.244.0.181.35026: Flags [P.], seq 22186:22977, ack 9106, win 9693, options [nop,nop,TS val 2336542539 ecr 1762608358], length 791
21:05:36.631839 IP 10.244.0.181.35026 > nodemaster.6443: Flags [.], ack 22978, win 10482, options [nop,nop,TS val 1762608366 ecr 2336542539], length 0
21:05:36.632768 IP 10.244.0.181.35026 > nodemaster.6443: Flags [P.], seq 9144:9183, ack 22978, win 10482, options [nop,nop,TS val 1762608367 ecr 2336542539], length 39
21:05:36.637929 IP 10.96.0.1.https > 10.244.0.181.35026: Flags [P.], seq 22977:23044, ack 9145, win 9693, options [nop,nop,TS val 2336542545 ecr 1762608367], length 67
21:05:36.638102 IP 10.96.0.1.https > 10.244.0.181.35026: Flags [P.], seq 23044:23847, ack 9145, win 9693, options [nop,nop,TS val 2336542546 ecr 1762608367], length 803
21:05:36.638225 IP 10.244.0.181.35026 > nodemaster.6443: Flags [.], ack 23848, win 10482, options [nop,nop,TS val 1762608373 ecr 2336542545], length 0
21:05:36.639466 IP 10.244.0.181.35026 > nodemaster.6443: Flags [P.], seq 9183:9224, ack 23848, win 10482, options [nop,nop,TS val 1762608374 ecr 2336542545], length 41
21:05:36.639579 IP 10.244.0.181.35026 > nodemaster.6443: Flags [P.], seq 9224:10015, ack 23848, win 10482, options [nop,nop,TS val 1762608374 ecr 2336542545], length 791
21:05:36.639631 IP 10.96.0.1.https > 10.244.0.181.35026: Flags [.], ack 9977, win 9693, options [nop,nop,TS val 2336542547 ecr 1762608374], length 0
21:05:36.641347 IP 10.96.0.1.https > 10.244.0.181.35026: Flags [P.], seq 23847:23882, ack 9977, win 9693, options [nop,nop,TS val 2336542549 ecr 1762608374], length 35
21:05:36.650576 IP 10.96.0.1.https > 10.244.0.181.35026: Flags [P.], seq 23882:23948, ack 9977, win 9693, options [nop,nop,TS val 2336542558 ecr 1762608374], length 66
21:05:36.650690 IP 10.96.0.1.https > 10.244.0.181.35026: Flags [P.], seq 23948:24739, ack 9977, win 9693, options [nop,nop,TS val 2336542558 ecr 1762608374], length 791
21:05:36.650745 IP 10.244.0.181.35026 > nodemaster.6443: Flags [.], ack 24740, win 10482, options [nop,nop,TS val 1762608385 ecr 2336542549], length 0
21:05:36.651179 IP 10.244.0.181.35026 > nodemaster.6443: Flags [P.], seq 10015:10050, ack 24740, win 10482, options [nop,nop,TS val 1762608386 ecr 2336542549], length 35
21:05:36.651843 IP 10.244.0.181.35026 > nodemaster.6443: Flags [P.], seq 10050:10089, ack 24740, win 10482, options [nop,nop,TS val 1762608386 ecr 2336542549], length 39
21:05:36.651932 IP 10.96.0.1.https > 10.244.0.181.35026: Flags [.], ack 10051, win 9693, options [nop,nop,TS val 2336542559 ecr 1762608386], length 0
21:05:36.656759 IP 10.96.0.1.https > 10.244.0.181.35026: Flags [P.], seq 24739:24806, ack 10051, win 9693, options [nop,nop,TS val 2336542564 ecr 1762608386], length 67
21:05:36.656880 IP 10.96.0.1.https > 10.244.0.181.35026: Flags [P.], seq 24806:25609, ack 10051, win 9693, options [nop,nop,TS val 2336542564 ecr 1762608386], length 803
21:05:36.656947 IP 10.244.0.181.35026 > nodemaster.6443: Flags [.], ack 25610, win 10482, options [nop,nop,TS val 1762608391 ecr 2336542564], length 0
21:05:36.658011 IP 10.244.0.181.35026 > nodemaster.6443: Flags [P.], seq 10089:10130, ack 25610, win 10482, options [nop,nop,TS val 1762608392 ecr 2336542564], length 41
21:05:36.658116 IP 10.244.0.181.35026 > nodemaster.6443: Flags [P.], seq 10130:10933, ack 25610, win 10482, options [nop,nop,TS val 1762608393 ecr 2336542564], length 803
21:05:36.658370 IP 10.96.0.1.https > 10.244.0.181.35026: Flags [.], ack 10895, win 9693, options [nop,nop,TS val 2336542566 ecr 1762608392], length 0
21:05:36.666168 IP 10.96.0.1.https > 10.244.0.181.35026: Flags [P.], seq 25609:25676, ack 10895, win 9693, options [nop,nop,TS val 2336542574 ecr 1762608392], length 67
21:05:36.666318 IP 10.96.0.1.https > 10.244.0.181.35026: Flags [P.], seq 25676:26479, ack 10895, win 9693, options [nop,nop,TS val 2336542574 ecr 1762608392], length 803
21:05:36.666415 IP 10.244.0.181.35026 > nodemaster.6443: Flags [.], ack 26480, win 10482, options [nop,nop,TS val 1762608401 ecr 2336542574], length 0
21:05:37.748930 IP 10.96.0.1.https > 10.244.0.184.55886: Flags [P.], seq 105:136, ack 1, win 501, options [nop,nop,TS val 544984228 ecr 1702711709], length 31
21:05:37.748990 IP 10.244.0.184.55886 > nodemaster.6443: Flags [.], ack 32, win 7990, options [nop,nop,TS val 1702713457 ecr 544984228], length 0
